paper_id,title,year,eigenvector,cluster_id
W2963517393,Robust Scene Text Recognition with Automatic Rectification,2016,0.20462000566964886,14
W2294053032,Recursive Recurrent Nets with Attention Modeling for OCR in the Wild,2016,0.1812384172475936,14
W2965066169,"Show, Attend and Read: A Simple and Strong Baseline for Irregular Text Recognition",2019,0.16651631480471976,14
W2875814315,Mask TextSpotter: An End-to-End Trainable Neural Network for Spotting Text with Arbitrary Shapes,2018,0.1536350659486206,14
W2963233387,Scene Text Recognition from Two-Dimensional Perspective,2019,0.15277651753475674,14
W2795619303,AON: Towards Arbitrarily-Oriented Text Recognition,2018,0.15265681898287017,14
W3035449864,Towards Accurate Scene Text Recognition With Semantic Reasoning Networks,2020,0.152634328539086,14
W3181186176,"Read Like Humans: Autonomous, Bidirectional and Iterative Language Modeling for Scene Text Recognition",2021,0.1486850048545385,14
W3004846386,What Is Wrong With Scene Text Recognition Model Comparisons? Dataset and Model Analysis,2019,0.1461713484550526,14
W2998382406,Decoupled Attention Network for Text Recognition,2020,0.14076706052719692,14
W4310335763,"ABINet++: Autonomous, Bidirectional and Iterative Language Modeling for Scene Text Spotting",2022,0.13434069458389677,14
W3005436539,Symmetry-Constrained Rectification Network for Scene Text Recognition,2019,0.1290305777666531,14
W3034447740,SEED: Semantics Enhanced Encoder-Decoder Framework for Scene Text Recognition,2020,0.1288586514859079,14
W2970910956,Mask TextSpotter: An End-to-End Trainable Neural Network for Spotting Text with Arbitrary Shapes,2019,0.12881576547681764,14
W2750938222,Focusing Attention: Towards Accurate Text Recognition in Natural Images,2017,0.12782549916388689,14
W3021481629,Text Recognition in the Wild: A Survey,2020,0.12423590843424308,14
W3134064484,Text Recognition in the Wild,2021,0.12385996568819799,14
W3110267192,RobustScanner: Dynamically Enhancing Positional Clues for Robust Text Recognition,2020,0.1204272740678428,14
W2964018263,FOTS: Fast Oriented Text Spotting with a Unified Network,2018,0.11523083290430361,14
W2740767790,Learning to Read Irregular Text with Attention Mechanisms,2017,0.11176245121424926,14
W2963327605,Edit Probability for Scene Text Recognition,2018,0.11084659932188938,14
W2964296749,Towards End-to-End Text Spotting with Convolutional Recurrent Neural Networks,2017,0.11022565647879802,14
W4396506223,SignboardText: Text Detection and Recognition in In-the-Wild Signboard Images,2024,0.10909062114450589,14
W3013224334,SCATTER: Selective Context Attentional Scene Text Recognizer,2020,0.10266120214951038,14
W4386410320,CDistNet: Perceiving Multi-domain Character Distance for Robust Text Recognition,2023,0.10048679947650199,14
W3202415716,From Two to One: A New Scene Text Recognizer with Visual Language Modeling Network,2021,0.09993727459650609,14
W2981969038,Towards Unconstrained End-to-End Text Spotting,2019,0.098967606538119,14
W2988098900,TextDragon: An End-to-End Framework for Arbitrary Shaped Text Spotting,2019,0.09478047158919158,14
W2788069964,Char-Net: A Character-Aware Neural Network for Distorted Scene Text Recognition,2018,0.09441127293395717,14
W4319777850,Image-to-Character-to-Word Transformers for Accurate Scene Text Recognition,2023,0.09412919274428748,14
W3175618949,Primitive Representation Learning for Scene Text Recognition,2021,0.09362432363207257,14
W2962986948,An End-to-End TextSpotter with Explicit Alignment and Attention,2018,0.09093191541599831,14
W2997749585,TextScanner: Reading Characters in Order for Robust Scene Text Recognition,2020,0.09049872550408591,14
W2997864923,GTC: Guided Training of CTC towards Efficient and Accurate Scene Text Recognition,2020,0.0895332654128946,14
W3003642782,NRTR: A No-Recurrence Sequence-to-Sequence Model for Scene Text Recognition,2019,0.0888354163710745,14
W3202912918,Joint Visual Semantic Reasoning: Multi-Stage Decoder for Text Recognition,2021,0.08794443259124683,14
W3097932944,Character Region Attention for Text Spotting,2020,0.08729856003194793,14
W4312879041,Scene Text Recognition with Permuted Autoregressive Sequence Models,2022,0.08521175953158558,14
W3035106683,On Vocabulary Reliance in Scene Text Recognition,2020,0.08446103866286706,14
W4312843595,Multi-granularity Prediction for Scene Text Recognition,2022,0.08428980042488526,14
W2978036638,MASTER: Multi-aspect non-local network for scene text recognition,2021,0.08246250807111337,14
W4390872592,Self-supervised Character-to-Character Distillation for Text Recognition,2023,0.08098971042442103,14
W4312787220,Levenshtein OCR,2022,0.08002479370725069,14
W4381090279,Scene text understanding: recapitulating the past decade,2023,0.0782454659348107,14
W2952285877,2D Attentional Irregular Scene Text Recognizer,2019,0.07799083073830453,14
W3111172959,MANGO: A Mask Attention Guided One-Stage Scene Text Spotter,2021,0.07742110427653129,14
W3206651063,"PIMNet: A Parallel, Iterative and Mimicking Network for Scene Text Recognition",2021,0.07716357326822995,14
W2983626510,Convolutional Character Networks,2019,0.07629531995509446,14
W4386065575,Self-Supervised Implicit Glyph Attention for Text Recognition,2023,0.07486205825419497,14
W4313045695,Toward Understanding WordArt: Corner-Guided Transformer for Scene Text Recognition,2022,0.07415879511666396,14
W4385767967,TPS++: Attention-Enhanced Thin-Plate Spline for Scene Text Recognition,2023,0.07403174535986036,14
W4390872070,LISTER: Neighbor Decoding for Length-Insensitive Scene Text Recognition,2023,0.07339009363155022,14
W4392980188,Turning a CLIP Model into a Scene Text Spotter,2024,0.07320324952602647,14
W4292825881,PETR: Rethinking the Capability of Transformer-Based Language Model in Scene Text Recognition,2022,0.07311154301326103,14
W3159307593,PAN++: Towards Efficient and Accurate End-to-End Spotting of Arbitrarily-Shaped Text,2021,0.07294711179951703,14
W3204479434,Vision Transformer for Fast and Efficient Scene Text Recognition,2021,0.07242426145515866,14
W2967615747,Character Region Awareness for Text Detection,2019,0.07202822275896414,14
W4406258852,Attention Guidance by Cross-Domain Supervision Signals for Scene Text Recognition,2025,0.07197120568368015,14
W3169016642,Implicit Feature Alignment: Learn to Convert Text Recognizer to Text Spotter,2021,0.071621640331768,14
W4225683503,SwinTextSpotter: Scene Text Spotting via Better Synergy between Text Detection and Text Recognition,2022,0.07141044292404711,14
W2996956254,Text Perceptron: Towards End-to-End Arbitrary-Shaped Text Spotting,2020,0.07048630906498485,14
W3103667010,PlugNet: Degradation Aware Scene Text Recognition Supervised by a Pluggable Super-Resolution Unit,2020,0.0703369399984688,14
W3179426054,Towards End-to-End Text Spotting in Natural Scenes,2021,0.07004033900355158,14
W3034414401,On Recognizing Texts of Arbitrary Shapes with 2D Self-Attention,2020,0.06961340861293219,14
W4312298799,SGBANet: Semantic GAN and Balanced Attention Network for Arbitrarily Oriented Scene Text Recognition,2022,0.06951941416061314,14
W4226329156,Visual Semantics Allow for Textual Reasoning Better in Scene Text Recognition,2022,0.0693585069574349,14
W4390874051,ESTextSpotter: Towards Better Scene Text Spotting with Explicit Synergy in Transformer,2023,0.0691787558805286,14
W4283819468,Context-Based Contrastive Learning for Scene Text Recognition,2022,0.06908580614511502,14
W3177684257,What If We Only Use Real Datasets for Scene Text Recognition? Toward Scene Text Recognition With Fewer Labels,2021,0.06655285206535153,14
W2997371611,All You Need Is Boundary: Toward Arbitrary-Shaped Text Spotting,2020,0.06566609852114347,14
W3113987534,SLOAN: Scale-Adaptive Orientation Attention Network for Scene Text Recognition,2020,0.065587555374584,14
W4386453743,SPTS v2: Single-Point Scene Text Spotting,2023,0.06524019426457264,14
W4312965673,Pushing the Performance Limit of Scene Text Recognizer without Human Annotation,2022,0.06467623933726707,14
W2810028092,TextSnake: A Flexible Representation for Detecting Text of Arbitrary Shapes,2018,0.06388244842681576,14
W4210692322,A Two-Level Rectification Attention Network for Scene Text Recognition,2022,0.06361822049616465,14
W2959965583,Sequence-To-Sequence Domain Adaptation Network for Robust Text Image Recognition,2019,0.0633369709882111,14
W4312230431,Text Spotting Transformers,2022,0.06318180573197857,14
W2928555987,A Simple and Robust Convolutional-Attention Network for Irregular Text Recognition.,2019,0.06284561684071652,14
W3003868038,ICDAR2019 Robust Reading Challenge on Multi-lingual Scene Text Detection and Recognition — RRC-MLT-2019,2019,0.06251845067012428,14
W4312880451,GLASS: Global to Local Attention for Scene-Text Spotting,2022,0.06044680095617705,14
W3201786596,Towards the Unseen: Iterative Text Recognition by Distilling from Errors,2021,0.05995613131191301,14
W4386075667,DeepSolo: Let Transformer Decoder with Explicit Points Solo for Text Spotting,2023,0.059767000940206344,14
W4313172891,Language Matters: A Weakly Supervised Vision-Language Pre-training Approach for Scene Text Detection and Spotting,2022,0.059315773631787166,14
W4407254152,"Arbitrary-Shape Text Spotting Based on Global, Pixel and Sequence Semantics",2025,0.0588690293794765,14
W4402716147,"OMNIPARSER: A Unified Framework for Text Spotting, Key Information Extraction and Table Recognition",2024,0.058805819176755876,14
W2906333459,TextNet: Irregular Text Reading from Images with an End-to-End Trainable Network,2019,0.05867571544546718,14
W2963840241,Multi-oriented Scene Text Detection via Corner Localization and Region Segmentation,2018,0.05853601694165545,14
W3119350346,Separating Content from Style Using Adversarial Learning for Recognizing Text in the Wild,2021,0.058358368373634575,14
W4382202677,TrOCR: Transformer-Based Optical Character Recognition with Pre-trained Models,2023,0.057412494483534415,14
W4225562651,Multi-modal Text Recognition Networks: Interactive Enhancements Between Visual and Semantic Features,2022,0.05720008452933562,14
W4318823461,Rethinking text rectification for scene text recognition,2023,0.0570112714617039,14
W3043311956,A holistic representation guided attention network for scene text recognition,2020,0.05620057528510271,14
W3014074635,Towards Accurate Scene Text Recognition with Semantic Reasoning Networks,2020,0.0560516579749554,14
W4390871731,CLIPTER: Looking at the Bigger Picture in Scene Text Recognition,2023,0.05574345943367548,14
W4385988828,A survey of text detection and recognition algorithms based on deep learning technology,2023,0.0553462156504339,14
W4393207191,Masked and Permuted Implicit Context Learning for Scene Text Recognition,2024,0.0553364929979388,14
W3204778874,"Text is Text, No Matter What: Unifying Text Recognition using Knowledge Distillation",2021,0.053790049966566875,14
W2896034938,Attention and Language Ensemble for Scene Text Recognition with Convolutional Sequence Modeling,2018,0.05316366258219842,14
W4320489219,Out-of-Vocabulary Challenge Report,2023,0.052917365752919436,14
W4280496051,Text proposals with location-awareness-attention network for arbitrarily shaped scene text detection and recognition,2022,0.0526923218539605,14
W3005400651,Chinese Street View Text: Large-Scale Chinese Text Reading With Partially Supervised Learning,2019,0.052226111246928913,14
W2788840914,SqueezedText: A Real-Time Scene Text Recognition by Binary Convolutional Encoder-Decoder Network,2018,0.05191811166163391,14
W2965463054,Total-Text: toward orientation robustness in scene text detection,2019,0.05187243267708851,14
W2963647456,Shape Robust Text Detection With Progressive Scale Expansion Network,2019,0.051635352792994006,14
W4394625882,DTrOCR: Decoder-only Transformer for Optical Character Recognition,2024,0.05145635431967829,14
W3176512504,MetaHTR: Towards Writer-Adaptive Handwritten Text Recognition,2021,0.05144849047125935,14
W2964294787,Rotation-Sensitive Regression for Oriented Scene Text Detection,2018,0.05069219499535648,14
W4283821822,Reading and Writing: Discriminative and Generative Modeling for Self-Supervised Text Recognition,2022,0.049111052530848305,14
W4281616076,STR Transformer: A Cross-domain Transformer for Scene Text Recognition,2022,0.048934529366452255,14
W3083321694,Street View Text Recognition With Deep Learning for Urban Scene Understanding in Intelligent Transportation Systems,2020,0.0487624554411631,14
W3213968854,Traditional to transfer learning progression on scene text detection and recognition: a survey,2021,0.048716959826930785,14
W4284685252,"Text detection, recognition, and script identification in natural scene images: a Review",2022,0.04825644236243887,14
W2894730515,Synthetically Supervised Feature Learning for Scene Text Recognition,2018,0.0482130960841746,14
W4207058148,EMU: Effective Multi-Hot Encoding Net for Lightweight Scene Text Recognition With a Large Character Set,2022,0.04808723701362958,14
W2902494497,TextField: Learning a Deep Direction Field for Irregular Scene Text Detection,2019,0.047419797051067025,14
W4312351507,Towards Weakly-Supervised Text Spotting using a Multi-Task Transformer,2022,0.04737886164987174,14
W4312800234,Open-Set Text Recognition via Character-Context Decoupling,2022,0.046621617452361895,14
W4283805255,Perceiving Stroke-Semantic Context: Hierarchical Contrastive Learning for Robust Scene Text Recognition,2022,0.04627867837694505,14
W4386083087,Conditional Text Image Generation with Diffusion Models,2023,0.04564931308788723,14
W4385767840,Linguistic More: Taking a Further Step toward Efficient and Accurate Scene Text Recognition,2023,0.045646808681834544,14
W4280542149,An extended attention mechanism for scene text recognition,2022,0.04559404896831667,14
W4403792358,DNTextSpotter: Arbitrary-Shaped Scene Text Spotting via Improved Denoising Training,2024,0.04489004511499012,14
W3176276424,"A Multiplexed Network for End-to-End, Multilingual OCR",2021,0.0448207961670013,14
W4404970060,FastTextSpotter: A High-Efficiency Transformer for Multilingual Scene Text Spotting,2024,0.04468413986579419,14
W2991626090,Efficient and Accurate Arbitrary-Shaped Text Detection With Pixel Aggregation Network,2019,0.044363492960300385,14
W2962957458,2D-CTC for Scene Text Recognition,2019,0.04419750129906136,14
W4296211656,A Transformer-Based Framework for Scene Text Recognition,2022,0.044031180201267714,14
W2964312704,Attention-Based Extraction of Structured Information from Street View Imagery,2017,0.04363814887233533,14
W4407254626,Language-Aware Non-autoregressive Khmer Textline Recognition,2025,0.04314886740775953,14
W3186819370,Dictionary-guided Scene Text Recognition,2021,0.043032973207939994,14
W4410192162,TextBlockV2: Towards Precise-Detection-Free Scene Text Spotting with Pre-trained Language Model,2025,0.04299125896710071,14
W3152831436,PGNet: Real-time Arbitrarily-Shaped Text Spotting with Point Gathering Network,2021,0.04293537042751623,14
W4401415142,Diving into the Depths of Spotting Text in Multi-Domain Noisy Scenes,2024,0.0427361740119566,14
W4229030834,SVTR: Scene Text Recognition with a Single Visual Model,2022,0.04248571581661159,14
W3175855397,Sequence-to-Sequence Contrastive Learning for Text Recognition,2021,0.04178549744629726,14
W4321609266,DOC: Text Recognition via Dual Adaptation and Clustering,2023,0.041189956590677076,14
W4304091583,SPTS: Single-Point Text Spotting,2022,0.04109320965610598,14
W3034514377,Deep Relational Reasoning Graph Network for Arbitrary Shape Text Detection,2020,0.040082010005981265,14
W4390805912,An Attention-Based Convolutional Recurrent Neural Networks for Scene Text Recognition,2024,0.03986548279911229,14
W3172799005,Progressive Contour Regression for Arbitrary-Shape Scene Text Detection,2021,0.039461767670948146,14
W4387968089,Symmetrical Linguistic Feature Distillation with CLIP for Scene Text Recognition,2023,0.03850396352544032,14
W3179897446,TextOCR: Towards large-scale end-to-end reasoning for arbitrary-shaped scene text,2021,0.03846407563961511,14
W3211262047,A decade: Review of scene text detection methods,2021,0.037858434342855164,14
W2968226676,Arbitrary Shape Scene Text Detection With Adaptive Text Region Representation,2019,0.03745306809088485,14
W3095672411,Adaptive Text Recognition Through Visual Matching,2020,0.03689858278959696,14
W3177505580,Scene Text Telescope: Text-Focused Scene Image Super-Resolution,2021,0.036845480081755894,14
W4386832326,An adaptive n-gram transformer for multi-scale scene text recognition,2023,0.03656907940380095,14
W3184364189,Adaptive Boundary Proposal Network for Arbitrary Shape Text Detection,2021,0.0357789299017868,14
W3152720259,Rethinking Text Line Recognition Models,2021,0.03559782415694233,14
W4380839071,Arbitrary Shape Text Detection via Boundary Transformer,2023,0.03506302906111041,14
W2972424968,TextSR: Content-Aware Text Super-Resolution Guided by Recognition,2019,0.034851678217968966,14
W4382464147,DPText-DETR: Towards Better Scene Text Detection with Dynamic Points in Transformer,2023,0.03480578219166333,14
W3092894544,Exploring Font-independent Features for Scene Text Recognition,2020,0.03445307270476559,14
W2873558679,Verisimilar Image Synthesis for Accurate Detection and Recognition of Texts in Scenes,2018,0.03250658933544535,14
W2963114696,E2E-MLT - An Unconstrained End-to-End Method for Multi-language Scene Text,2019,0.032048199295696855,14
W3186906052,MOST: A Multi-Oriented Scene Text Detector with Localization Refinement,2021,0.03186937463787095,14
W3106940130,AE TextSpotter: Learning Visual and Linguistic Representation for Ambiguous Text Spotting,2020,0.031173273263050357,14
W2994189733,Adaptive embedding gate for attention-based scene text recognition,2019,0.031114183490775153,14
W4312932251,SimAN: Exploring Self-Supervised Representation Learning of Scene Text via Similarity-Aware Normalization,2022,0.031018927959075532,14
W4304080540,You Can even Annotate Text with Voice: Transcription-only-Supervised Text Spotting,2022,0.02958617435472508,14
W3113417909,On Calibration of Scene-Text Recognition Models,2023,0.02949089868668848,14
W3093218477,TRIE: End-to-End Text Reading and Information Extraction for Document Understanding,2020,0.029319786985450666,14
W2963398399,Scene Text Detection with Supervised Pyramid Context Network,2019,0.028540772540678192,14
W4406067002,IMTLM-Net: improved multi-task transformer based on localization mechanism network for handwritten English text recognition,2025,0.02839295012532021,14
W4304092561,Decoupling Recognition from Detection: Single Shot Self-Reliant Scene Text Spotter,2022,0.02823941889342493,14
W2963360699,Visual Attention Models for Scene Text Recognition,2017,0.02818278531276796,14
W3014690505,ASTS: A Unified Framework for Arbitrary Shape Text Spotting,2020,0.027964860797986373,14
W3025830232,Multi-branch guided attention network for irregular text recognition,2020,0.027813863516071378,14
W3199928321,TrOCR: Transformer-based Optical Character Recognition with Pre-trained Models,2021,0.027618217599059476,14
W4391964546,Collaborative Encoding Method for Scene Text Recognition in Low Linguistic Resources: The Uyghur Language Case Study,2024,0.026902265780148232,14
W3189348500,I3CL: Intra- and Inter-Instance Collaborative Learning for Arbitrary-Shaped Scene Text Detection,2022,0.026175025665120113,14
W4386075746,Towards Unified Scene Text Spotting Based on Sequence Generation,2023,0.025405132137552036,14
W2997351497,Convolutional Attention Networks for Scene Text Recognition,2019,0.025022162385698002,14
W4321485374,Visual Matching is Enough for Scene Text Retrieval,2023,0.024900386441406616,14
W3109569233,A Survey of Deep Learning Approaches for OCR and Document Understanding,2020,0.024171445485235404,14
W3207420819,Met-MLTS: Leveraging Smartphones for End-to-End Spotting of Multilingual Oriented Scene Texts and Traffic Signs in Adverse Meteorological Conditions,2021,0.023694458855139787,14
W3205961173,MMOCR,2021,0.023549383648495688,14
W2964099383,Joint Line Segmentation and Transcription for End-to-End Handwritten Paragraph Recognition,2016,0.023067012209189837,14
W4386065412,Turning a CLIP Model into a Scene Text Detector,2023,0.023019109117162907,14
W3171030392,Self-attention based Text Knowledge Mining for Text Detection,2021,0.02248751938738433,14
W3035222584,TextFuseNet: Scene Text Detection with Richer Fused Features,2020,0.02213050819639166,14
W4212915707,SeeTek: Very Large-Scale Open-set Logo Recognition with Text-Aware Metric Learning,2022,0.02194915152267179,14
W4313006333,Vision-Language Pre-Training for Boosting Scene Text Detectors,2022,0.02191797194996577,14
W2909425146,Review of Scene Text Detection and Recognition,2019,0.02189101950700909,14
W4392472425,The Industrial Application of Artificial Intelligence-Based Optical Character Recognition in Modern Manufacturing Innovations,2024,0.021472869826803433,14
W3177167102,Scene Text Retrieval via Joint Text Detection and Similarity Learning,2021,0.021442943020874343,14
W4406984680,MTMFNet: multi-threshold and multi-scale feature fusion network for text detection,2025,0.020701316761224577,14
W4375869061,A3S: Adversarial Learning of Semantic Representations for Scene-Text Spotting,2023,0.020361799450360932,14
W2982148195,Editing Text in the Wild,2019,0.020213268725318617,14
W4312593844,Few Could Be Better Than All: Feature Sampling and Grouping for Scene Text Detection,2022,0.02010860510398891,14
W3184923351,Transformer-based Text Detection in the Wild,2021,0.01932071127816447,14
W4392293656,Enhancing medical text detection with vision-language pre-training and efficient segmentation,2024,0.019022600211930488,14
W2963299454,Handwriting Recognition in Low-Resource Scripts Using Adversarial Learning,2019,0.01874747126724325,14
W4312233877,OCR-Free Document Understanding Transformer,2022,0.018015059551331654,14
W4226544595,Text Gestalt: Stroke-Aware Scene Text Image Super-resolution,2022,0.017891697508610537,14
W4400584620,End-to-End Video Text Spotting with Transformer,2024,0.017793193551538796,14
W4407253873,Shared Vision Transformer Helps Scene Text Retrieval,2025,0.017551942831192623,14
W4210337376,Recognition of Handwritten Chinese Text by Segmentation: A Segment-Annotation-Free Approach,2022,0.017354901352761066,14
W3104953317,LayoutLM: Pre-training of Text and Layout for Document Image Understanding,2020,0.017141481686434534,14
W2891117443,Chargrid: Towards Understanding 2D Documents,2018,0.016385890610208224,14
W4292261508,Center TextSpotter: A Novel Text Spotter for Autonomous Unmanned Vehicles,2022,0.0163176643489914,14
W2962707697,"Scan, Attend and Read: End-to-End Handwritten Paragraph Recognition with MDLSTM Attention",2017,0.015923787184805284,14
W2946143059,Natural Scene Text Recognition Based on Encoder-Decoder Framework,2019,0.015745209939287092,14
W2890023978,Recurrent Global Convolutional Network for Scene Text Detection,2018,0.015651989880707148,14
W4394625581,Scene Text Image Super-resolution based on Text-conditional Diffusion Models,2024,0.014970891696988594,14
W4402082933,HierCode: A lightweight hierarchical codebook for zero-shot Chinese text recognition,2024,0.01420570724176159,14
W3173306993,Spatial Dependency Parsing for Semi-Structured Document Information Extraction,2021,0.01406980109160733,14
W3176664887,DocFormer: End-to-End Transformer for Document Understanding,2021,0.01382759872443162,14
W3180751782,"Split, Embed and Merge: An accurate table structure recognizer",2022,0.013665684653976329,14
W3122447812,2D Positional Embedding-based Transformer for Scene Text Recognition,2021,0.013124116973053816,14
W3034726763,"OrigamiNet: Weakly-Supervised, Segmentation-Free, One-Step, Full Page Text Recognition by learning to unfold",2020,0.012608223520726256,14
W3176851559,LayoutLMv2: Multi-modal Pre-training for Visually-rich Document Understanding,2021,0.012473655586308132,14
W3087858202,PP-OCR: A Practical Ultra Lightweight OCR System,2020,0.012451100778890327,14
W4392133760,An approach for handwritten Chinese text recognition unifying character segmentation and recognition,2024,0.012234034991677986,14
W3109173194,A Robust License Plate Recognition Model Based on Bi-LSTM,2020,0.012140095969156729,14
W3216533828,Donut: Document Understanding Transformer without OCR,2021,0.01188929054395519,14
W4385990942,DocParser: End-to-end OCR-Free Information Extraction from Visually Rich Documents,2023,0.011815770282090642,14
W4312923907,A Text Attention Network for Spatial Deformation Robust Scene Text Image Super-resolution,2022,0.011776808237823911,14
W3128247800,Text Detection Using Multi-Stage Region Proposal Network Sensitive to Text Scale,2021,0.011311018939026956,14
W3031548983,Pay attention to what you read: Non-recurrent handwritten text-Line recognition,2022,0.010828602768868377,14
W3167911358,TextStyleBrush: Transfer of Text Aesthetics From a Single Example,2023,0.010804683764375066,14
W2592175858,A Novel Text Structure Feature Extractor for Chinese Scene Text Detection and Recognition,2017,0.010632183469338788,14
W3200439183,BROS: A Pre-trained Language Model Focusing on Text and Layout for Better Key Information Extraction from Documents,2022,0.010463034813286589,14
W4292937962,Business Document Information Extraction: Towards Practical Benchmarks,2022,0.010187573980153878,14
W3133170446,Dense Residual Network: Enhancing global dense feature flow for character recognition,2021,0.010161326887212928,14
W4313125865,Syntax-Aware Network for Handwritten Mathematical Expression Recognition,2022,0.010054602898361626,14
W3000758063,CORD: A Consolidated Receipt Dataset for Post-OCR Parsing,2019,0.009976765185897993,14
