id,title,year,pagerank,cluster
W3207576805,A Deformable Attention Network for High-Resolution Remote Sensing Images Semantic Segmentation,2021,3.7749135919952736e-05,0
W4206873376,Self-Supervised Pretraining for RGB-D Salient Object Detection,2022,3.774740013028638e-05,0
W4382462216,Bi-directional Feature Reconstruction Network for Fine-Grained Few-Shot Image Classification,2023,3.774721341360446e-05,0
W4226016322,NHBS-Net: A Feature Fusion Attention Network for Ultrasound Neonatal Hip Bone Segmentation,2021,3.7736293469694434e-05,0
W4380905880,High-Resolution Feature Pyramid Network for Small Object Detection on Drone View,2023,3.773256865534693e-05,0
W4200017248,Group-Wise Learning for Weakly Supervised Semantic Segmentation,2021,3.7727148308384806e-05,0
W4225649887,Domain-Agnostic Prior for Transfer Semantic Segmentation,2022,3.7719709177242426e-05,0
W3034643863,Understanding Adversarial Examples From the Mutual Influence of Images and Perturbations,2020,3.770493499133929e-05,0
W4283796844,Laneformer: Object-Aware Row-Column Transformers for Lane Detection,2022,3.770030860099689e-05,0
W4390872682,NDC-Scene: Boost Monocular 3D Semantic Scene Completion in Normalized Device Coordinates Space,2023,3.7697596787306423e-05,0
W3164698655,RelationTrack: Relation-Aware Multiple Object Tracking With Decoupled Representation,2022,3.7692257552151295e-05,0
W3022950738,AResU-Net: Attention Residual U-Net for Brain Tumor Segmentation,2020,3.7692016279347896e-05,0
W4226017195,Learning Discriminative Cross-Modality Features for RGB-D Saliency Detection,2022,3.768811099270181e-05,0
W3148722043,Distilling a Powerful Student Model via Online Knowledge Distillation,2022,3.76836829076312e-05,0
W4221166948,Unpaired Deep Image Dehazing Using Contrastive Disentanglement Learning,2022,3.7682316166648115e-05,0
W3047585969,Crowd Counting via Segmentation Guided Attention Networks and Curriculum Loss,2022,3.768157835855986e-05,0
W3145166545,Facial expression and attributes recognition based on multi-task learning of lightweight neural networks,2021,3.767633822780009e-05,0
W4366976290,Credible Dual-Expert Learning for Weakly Supervised Semantic Segmentation,2023,3.7669330407476276e-05,0
W4223493056,RDCTrans U-Net: A Hybrid Variable Architecture for Liver CT Image Segmentation,2022,3.766731431118608e-05,0
W4312556441,Class-Guided Swin Transformer for Semantic Segmentation of Remote Sensing Imagery,2022,3.7660200833738164e-05,0
W4387101827,<scp>MMTFN</scp>: Multi‐modal multi‐scale transformer fusion network for Alzheimer's disease diagnosis,2023,3.765732163929676e-05,0
W3034954654,Transferring and Regularizing Prediction for Semantic Segmentation,2020,3.7655094562956e-05,0
W4312887531,SPSN: Superpixel Prototype Sampling Network for RGB-D Salient Object Detection,2022,3.764943494998826e-05,0
W4376130727,WetMapFormer: A unified deep CNN and vision transformer for complex wetland mapping,2023,3.7637769754830086e-05,0
W4400881081,TransUNet: Rethinking the U-Net architecture design for medical image segmentation through the lens of transformers,2024,3.76367877149824e-05,0
W4285234694,MANet: Multi-Scale Aware-Relation Network for Semantic Segmentation in Aerial Scenes,2022,3.762986805433411e-05,0
W4312742569,ParC-Net: Position Aware Circular Convolution with Merits from ConvNets and Transformer,2022,3.7625498651556576e-05,0
W4312613051,An End-to-End Transformer Model for Crowd Localization,2022,3.762330743448664e-05,0
W4319299890,Holistic Interaction Transformer Network for Action Detection,2023,3.761613008754218e-05,0
W4386065815,Universal Instance Perception as Object Discovery and Retrieval,2023,3.7596996386128726e-05,0
W4390575607,MICU: Image super-resolution via multi-level information compensation and U-net,2024,3.759516439274991e-05,0
W4393148571,Cross-Layer and Cross-Sample Feature Optimization Network for Few-Shot Fine-Grained Image Classification,2024,3.759516439274991e-05,0
W4221141660,Attribute Surrogates Learning and Spectral Tokens Pooling in Transformers for Few-shot Learning,2022,3.758644220048242e-05,0
W3200643978,RobustART: Benchmarking Robustness on Architecture Design and Training Techniques,2021,3.7586322593440935e-05,0
W4285144577,MLFNet: Multi-Level Fusion Network for Real-Time Semantic Segmentation of Autonomous Driving,2022,3.758459211398104e-05,0
W4385976925,MMS-Net: Multi-level multi-scale feature extraction network for medical image segmentation,2023,3.757999622999252e-05,0
W4313427331,Dynamic Unary Convolution in Transformers,2023,3.7579401550054506e-05,0
W4319083668,Remote Sensing Image Change Detection Based on Deep Multi-Scale Multi-Attention Siamese Transformer Network,2023,3.7568390817372215e-05,0
W4312557989,Detector-Free Weakly Supervised Group Activity Recognition,2022,3.755497714519904e-05,0
W4386065714,Rethinking Feature-based Knowledge Distillation for Face Recognition,2023,3.7554587308915924e-05,0
W4207045938,Wavelet-Attention CNN for image classification,2022,3.7550804032899414e-05,0
W4319996167,FHENet: Lightweight Feature Hierarchical Exploration Network for Real-Time Rail Surface Defect Inspection in RGB-D Images,2023,3.754769447905929e-05,0
W4385647259,ProxyMix: Proxy-based Mixup training with label refinery for source-free domain adaptation,2023,3.7536586115831814e-05,0
W4386108434,ETDNet: Efficient Transformer-Based Detection Network for Surface Defect Detection,2023,3.7536586115831814e-05,0
W2902036000,Effective Building Extraction From High-Resolution Remote Sensing Images With Multitask Driven Deep Neural Network,2018,3.753114267844022e-05,0
W3087801137,FPGAN: Face de-identification method with generative adversarial networks for social robots,2020,3.752159467892639e-05,0
W3155050726,Decoupled Spatial-Temporal Transformer for Video Inpainting,2021,3.752144228950849e-05,0
W2800452261,Multi-scale deep context convolutional neural networks for semantic segmentation,2018,3.750432678103643e-05,0
W4402727737,A Simple Recipe for Language-Guided Domain Generalized Segmentation,2024,3.7504113375366345e-05,0
W4281752744,Motion-Driven Visual Tempo Learning for Video-Based Action Recognition,2022,3.7504113375366345e-05,0
W3105389099,Research on image Inpainting algorithm of improved GAN based on two-discriminations networks,2020,3.750411337536634e-05,0
W4220862900,Hinge attention network: A joint model for diabetic retinopathy severity grading,2022,3.750411337536634e-05,0
W4390874306,Humans in 4D: Reconstructing and Tracking Humans with Transformers,2023,3.750411337536634e-05,0
W4319265540,YOLOSR-IST: A deep learning method for small target detection in infrared remote sensing images based on super-resolution and YOLO,2023,3.750411337536634e-05,0
W4394866263,An ensemble deep learning model for human activity analysis using wearable sensory data,2024,3.750411337536634e-05,0
W4386404700,Review of vision-based defect detection research and its perspectives for printed circuit board,2023,3.750411337536634e-05,0
W3158768656,A hybrid attention improved ResNet based fault diagnosis method of wind turbines gearbox,2021,3.750411337536634e-05,0
W4403835542,BGF-YOLOv10: Small Object Detection Algorithm from Unmanned Aerial Vehicle Perspective Based on Improved YOLOv10,2024,3.750411337536634e-05,0
W4381682624,CSN: Component supervised network for few-shot classification,2023,3.750411337536634e-05,0
W4365482845,FS-BAN: Born-Again Networks for Domain Generalization Few-Shot Classification,2023,3.750411337536634e-05,0
W3166398490,An ensemble deep learning method as data fusion system for remote sensing multisensor classification,2021,3.750411337536634e-05,0
W4220819800,Efficacy of Transfer Learning-based ResNet models in Chest X-ray image classification for detecting COVID-19 Pneumonia,2022,3.750411337536634e-05,0
W4312430207,Attention-Based Interrelation Modeling for Explainable Automated Driving,2022,3.750411337536634e-05,0
W3141012605,MESNet: A Convolutional Neural Network for Spotting Multi-Scale Micro-Expression Intervals in Long Videos,2021,3.750411337536634e-05,0
W4225793543,Robust Sewer Defect Detection With Text Analysis Based on Deep Learning,2022,3.750411337536634e-05,0
W4382677675,Multipretext-Task Prototypes Guided Dynamic Contrastive Learning Network for Few-Shot Remote Sensing Scene Classification,2023,3.750411337536634e-05,0
W4391992749,Adaptive Feature Fusion and Improved Attention Mechanism-Based Small Object Detection for UAV Target Tracking,2024,3.750411337536634e-05,0
W3202988816,Interpretable Image Recognition by Constructing Transparent Embedding Space,2021,3.750411337536634e-05,0
W4317933316,A Real-Time Polyp-Detection System with Clinical Application in Colonoscopy Using Deep Convolutional Neural Networks,2023,3.750411337536634e-05,0
W4389104738,Structured Pruning for Deep Convolutional Neural Networks: A Survey,2023,3.750411337536634e-05,0
W4224239473,Refined U-net: A new semantic technique on hand segmentation,2022,3.750411337536634e-05,0
W3186721627,Automatic Pancreatic Ductal Adenocarcinoma Detection in Whole Slide Images Using Deep Convolutional Neural Networks,2021,3.750411337536634e-05,0
W4312972648,IntegratedPIFu: Integrated Pixel Aligned Implicit Function for Single-View Human Reconstruction,2022,3.750411337536634e-05,0
W4386071485,DARE-GRAM : Unsupervised Domain Adaptation Regression by Aligning Inverse Gram Matrices,2023,3.750411337536634e-05,0
W4380985972,Global contextual attention augmented YOLO with ConvMixer prediction heads for PCB surface defect detection,2023,3.750411337536634e-05,0
W4391130440,"A Review of Machine Learning and Deep Learning for Object Detection, Semantic Segmentation, and Human Action Recognition in Machine and Robotic Vision",2024,3.750411337536634e-05,0
W4321483965,Learning Patch-Channel Correspondence for Interpretable Face Forgery Detection,2023,3.750411337536634e-05,0
W4386066070,"Decompose, Adjust, Compose: Effective Normalization by Playing with Frequency for Domain Generalization",2023,3.750411337536634e-05,0
W4225134630,Multi-scale attention integrated hierarchical networks for high-resolution building footprint extraction,2022,3.750411337536634e-05,0
W4200567002,NGCU: A New RNN Model for Time-Series Data Prediction,2021,3.750411337536634e-05,0
W4372341889,FAPM: Fast Adaptive Patch Memory for Real-Time Industrial Anomaly Detection,2023,3.750411337536634e-05,0
W4390871905,Cross Contrasting Feature Perturbation for Domain Generalization,2023,3.750411337536634e-05,0
W4206571460,NFANet: A Novel Method for Weakly Supervised Water Extraction From High-Resolution Remote-Sensing Imagery,2022,3.750411337536634e-05,0
W4289535494,Solar Cell Surface Defect Detection Based on Improved YOLO v5,2022,3.750411337536634e-05,0
W4387125416,A lightweight surface defect detection framework combined with dual-domain attention mechanism,2023,3.750411337536634e-05,0
W4285259499,Fast Visual Tracking With Siamese Oriented Region Proposal Network,2022,3.750411337536634e-05,0
W4296708919,"Explainable Convolutional Neural Networks: A Taxonomy, Review, and Future Directions",2022,3.750411337536634e-05,0
W3135698771,"An automated deep learning convolutional neural network algorithm applied for soil salinity distribution mapping in Lake Urmia, Iran",2021,3.750411337536634e-05,0
W4406681000,Enhanced YOLOv8-based method for space debris detection using cross-scale feature fusion,2025,3.750411337536634e-05,0
W3180632644,Tomato Leaf Disease Diagnosis Based on Improved Convolution Neural Network by Attention Module,2021,3.750411337536634e-05,0
W3196676412,MC-Net: Multiple max-pooling integration module and cross multi-scale deconvolution network,2021,3.750411337536634e-05,0
W4389286635,SSCNet: A Spectrum-Space Collaborative Network for Semantic Segmentation of Remote Sensing Images,2023,3.750411337536634e-05,0
W4317620533,Multi-Scale Fully Convolutional Network-Based Semantic Segmentation for Mobile Robot Navigation,2023,3.750411337536634e-05,0
W4286364677,Multifeature Transformation and Fusion-Based Ship Detection With Small Targets and Complex Backgrounds,2022,3.750411337536634e-05,0
W4386071489,Dynamic Aggregated Network for Gait Recognition,2023,3.750411337536634e-05,0
W4312943450,Hypergraph-Induced Semantic Tuplet Loss for Deep Metric Learning,2022,3.750411337536634e-05,0
W4220898925,A critical review on diagnosis of diabetic retinopathy using machine learning and deep learning,2022,3.750411337536634e-05,0
W4206667148,Computer vision to recognize construction waste compositions: A novel boundary-aware transformer (BAT) model,2022,3.750411337536634e-05,0
W4398757498,MCTformer+: Multi-Class Token Transformer for Weakly Supervised Semantic Segmentation,2024,3.750411337536634e-05,0
W4290714341,Glance and Focus Networks for Dynamic Visual Recognition,2022,3.750349043573521e-05,0
W4386838484,SMFF-YOLO: A Scale-Adaptive YOLO Algorithm with Multi-Level Feature Fusion for Object Detection in UAV Scenes,2023,3.749614831579034e-05,0
W4385226200,Faster and Better: A Lightweight Transformer Network for Remote Sensing Scene Classification,2023,3.7490741772910147e-05,0
W4304092639,SIR-Former: Stereo Image Restoration Using Transformer,2022,3.7479819930381916e-05,0
W3130089842,Applying Surface Normal Information in Drivable Area and Road Anomaly Detection for Ground Mobile Robots,2020,3.747953299104126e-05,0
W4312601813,SimpleRecon: 3D Reconstruction Without 3D Convolutions,2022,3.747949308379967e-05,0
W4220815323,Two-Stream Swin Transformer with Differentiable Sobel Operator for Remote Sensing Image Classification,2022,3.7476188775866444e-05,0
W4214664134,Unsupervised Spatial-Spectral CNN-Based Feature Learning for Hyperspectral Image Classification,2022,3.7473315460906256e-05,0
W4225297260,Noise-reducing attention cross fusion learning transformer for histological image classification of osteosarcoma,2022,3.7466187971772604e-05,0
W3199733685,Region-to-boundary deep learning model with multi-scale feature fusion for medical image segmentation,2021,3.7464634863782075e-05,0
W3105536096,3DCD: Scene Independent End-to-End Spatiotemporal Feature Learning Framework for Change Detection in Unseen Videos,2020,3.7457360355935166e-05,0
W4386824854,SegTransConv: Transformer and CNN Hybrid Method for Real-Time Semantic Segmentation of Autonomous Vehicles,2023,3.744264344888388e-05,0
W3132531378,DFFNet: An IoT-perceptive dual feature fusion network for general real-time semantic segmentation,2021,3.743902476124879e-05,0
W4386634608,Multiscale Neighborhood Attention Transformer With Optimized Spatial Pattern for Hyperspectral Image Classification,2023,3.7438702856054665e-05,0
W4226224140,ASF-Net: Adaptive Screening Feature Network for Building Footprint Extraction From Remote-Sensing Images,2022,3.743789470991595e-05,0
W4390873799,MOSE: A New Dataset for Video Object Segmentation in Complex Scenes,2023,3.743451686687422e-05,0
W4319459150,QCNN-H: Single-Image Dehazing Using Quaternion Neural Networks,2023,3.7433144774771956e-05,0
W4362523370,A COVID-19 medical image classification algorithm based on Transformer,2023,3.742902879101747e-05,0
W4310595710,Cluster Alignment With Target Knowledge Mining for Unsupervised Domain Adaptation Semantic Segmentation,2022,3.74285485926963e-05,0
W3217745064,Deep Learning-Based Building Extraction from Remote Sensing Images: A Comprehensive Review,2021,3.7424609126168016e-05,0
W4377710514,MSAFFNet: A Multiscale Label-Supervised Attention Feature Fusion Network for Infrared Small Target Detection,2023,3.7424081681149704e-05,0
W4386075642,Efficient Frequency Domain-based Transformers for High-Quality Image Deblurring,2023,3.74226466756021e-05,0
W4391953443,An Adaptive Dual Selective Transformer for Temporal Action Localization,2024,3.74226466756021e-05,0
W4393153879,Learning from History: Task-agnostic Model Contrastive Learning for Image Restoration,2024,3.74226466756021e-05,0
W4388705906,CT-Net: Asymmetric compound branch Transformer for medical image segmentation,2023,3.741927038189529e-05,0
W3131439390,HeatNet: Bridging the Day-Night Domain Gap in Semantic Segmentation with Thermal Images,2020,3.7418094514483384e-05,0
W4294310792,Focal Inverse Distance Transform Maps for Crowd Localization,2022,3.74164079580476e-05,0
W4318766188,Lightweight Remote Sensing Change Detection With Progressive Feature Aggregation and Supervised Attention,2023,3.74016717219092e-05,0
W3193940683,Amplitude-Phase Recombination: Rethinking Robustness of Convolutional Neural Networks in Frequency Domain,2021,3.740129946480193e-05,0
W4319341864,G2Grad-CAMRL: An Object Detection and Interpretation Model Based on Gradient-Weighted Class Activation Mapping and Reinforcement Learning in Remote Sensing Images,2023,3.740129946480193e-05,0
W4206007731,B-FGC-Net: A Building Extraction Network from High Resolution Remote Sensing Imagery,2022,3.739383565180007e-05,0
W4306795667,CovidViT: a novel neural network with self-attention mechanism to detect Covid-19 through X-ray images,2022,3.739208311709613e-05,0
W2948467257,SAIL-VOS: Semantic Amodal Instance Level Video Object Segmentation – A Synthetic Dataset and Baselines,2019,3.7390980765859036e-05,0
W4229374375,Multiple attentional path aggregation network for marine object detection,2022,3.738811766735805e-05,0
W4389104909,A Hybrid Deep Learning Model for Rapid Probabilistic Earthquake Source Parameter Estimation With Displacement Waveforms From a Flexible Set of Seismic or HR-GNSS Stations,2023,3.7388023328202294e-05,0
W4320001418,Understanding Deep Learning Techniques for Recognition of Human Emotions Using Facial Expressions: A Comprehensive Survey,2023,3.7388023328202294e-05,0
W4328055086,Self-supervised vision transformer-based few-shot learning for facial expression recognition,2023,3.7388023328202294e-05,0
W4394686522,Text-to-Image Segmentation with Open-Vocabulary and Multitasking,2024,3.738679363155092e-05,0
W4401130407,Image Analysis in Autonomous Vehicles: A Review of the Latest AI Solutions and Their Comparison,2024,3.738679363155092e-05,0
W4385325854,ELS2T: Efficient Lightweight Spectral–Spatial Transformer for Hyperspectral Image Classification,2023,3.738350033935174e-05,0
W4308787184,Low-light image enhancement with knowledge distillation,2022,3.738350033935174e-05,0
W2999157894,Towards resource-frugal deep convolutional neural networks for hyperspectral image segmentation,2020,3.7376123401755844e-05,0
W4312916726,Improving Vision Transformers by Revisiting High-Frequency Components,2022,3.737062527096492e-05,0
W3193915232,A Highly Efficient Model to Study the Semantics of Salient Object Detection,2021,3.736728755348582e-05,0
W3168233760,Hybrid attention network based on progressive embedding scale-context for crowd counting,2022,3.73643464576494e-05,0
W4312511177,Panoptic-PartFormer: Learning a Unified Model for Panoptic Part Segmentation,2022,3.7350187861310065e-05,0
W4285290151,Transferring Transformer-Based Models for Cross-Area Building Extraction From Remote Sensing Images,2022,3.734372233928006e-05,0
W4364322324,Temporal Pixel-Level Semantic Understanding Through the VSPW Dataset,2023,3.7343545151138124e-05,0
W4319300012,Token Pooling in Vision Transformers for Image Classification,2023,3.7340012674331275e-05,0
W3205387145,Auto-MSFNet: Search Multi-scale Fusion Network for Salient Object Detection,2021,3.7333184405664624e-05,0
W4387682254,Dif-Fusion: Toward High Color Fidelity in Infrared and Visible Image Fusion With Diffusion Models,2023,3.7325513302806265e-05,0
W4293195506,AFARN: Domain Adaptation for Intelligent Cross-Domain Bearing Fault Diagnosis in Nuclear Circulating Water Pump,2022,3.732418903187863e-05,0
W4282969740,Exploring Segment-Level Semantics for Online Phase Recognition From Surgical Videos,2022,3.732121978087109e-05,0
W4285411567,SWCGAN: Generative Adversarial Network Combining Swin Transformer and CNN for Remote Sensing Image Super-Resolution,2022,3.732022574805976e-05,0
W4225922183,Continual Attentive Fusion for Incremental Learning in Semantic Segmentation,2022,3.7303958121635225e-05,0
W4293578078,A self-supervised contrastive learning approach for whole slide image representation in digital pathology,2022,3.7301674735590114e-05,0
W4312732149,Transformer-Based Feature Compensation and Aggregation for DeepFake Detection,2022,3.729995290264298e-05,0
W3121461812,AMPNet: Average- and Max-Pool Networks for Salient Object Detection,2021,3.728560587178672e-05,0
W3121754326,Reconstruction Bias U-Net for Road Extraction From Optical Remote Sensing Images,2021,3.728559093364578e-05,0
W2982872774,Heartbeat Sound Signal Classification Using Deep Learning,2019,3.725666457617092e-05,0
W3005771459,Automated heart sound classification system from unsegmented phonocardiogram (PCG) using deep neural network,2020,3.725666457617092e-05,0
W4283030004,Automatic Detection of Coseismic Landslides Using a New Transformer Method,2022,3.724240037843295e-05,0
W4283796021,Learning from the Target: Dual Prototype Network for Few Shot Semantic Segmentation,2022,3.723417468920146e-05,0
W2995969896,HsgNet: A Road Extraction Network Based on Global Perception of High-Order Spatial Information,2019,3.723091337694721e-05,0
W4376154953,TransU-Net++: Rethinking attention gated TransU-Net for deforestation mapping,2023,3.722684778001233e-05,0
W4390577971,TCNet: Multiscale Fusion of Transformer and CNN for Semantic Segmentation of Remote Sensing Images,2024,3.7222682957998955e-05,0
W4303980685,Unsupervised Domain Adaptation for Remote Sensing Semantic Segmentation with Transformer,2022,3.7217114679706086e-05,0
W4403843325,DiffiT: Diffusion Vision Transformers for Image Generation,2024,3.7215207048536236e-05,0
W4316259280,Memory-augmented appearance-motion network for video anomaly detection,2023,3.7214446868963314e-05,0
W4313166855,MTFormer: Multi-task Learning via Transformer and Cross-Task Reasoning,2022,3.7195679332346485e-05,0
W3123073509,Convolutional Neural Networks with Gated Recurrent Connections,2021,3.7177076349795586e-05,0
W4226081887,NPCNet: Jointly Segment Primary Nasopharyngeal Carcinoma Tumors and Metastatic Lymph Nodes in MR Images,2022,3.7172427526326206e-05,0
W4312717513,Improving Test-Time Adaptation Via Shift-Agnostic Weight Regularization and Nearest Source Prototypes,2022,3.716890717158429e-05,0
W4386914050,Augmented weighted bidirectional feature pyramid network for marine object detection,2023,3.7167620485035766e-05,0
W4295424676,3-D Convolutional Neural Networks for RGB-D Salient Object Detection and Beyond,2022,3.715728525475555e-05,0
W3200556990,Multi-Modality and Multi-Scale Attention Fusion Network for Land Cover Classification from VHR Remote Sensing Images,2021,3.7149188622872787e-05,0
W3123090129,Haze concentration adaptive network for image dehazing,2021,3.714423830067232e-05,0
W4220947405,Multi-modal interactive attention and dual progressive decoding network for RGB-D/T salient object detection,2022,3.714256777184587e-05,0
W4280583458,Facial Expression Recognition Based on Squeeze Vision Transformer,2022,3.7134735952571644e-05,0
W4313193611,End-to-End Semi-Supervised Learning for Video Action Detection,2022,3.7134735952571644e-05,0
W3175703004,DeepLab2: A TensorFlow Library for Deep Labeling,2021,3.713375421355795e-05,0
W4283828743,Full-Resolution Network and Dual-Threshold Iteration for Retinal Vessel and Coronary Angiograph Segmentation,2022,3.713349300482234e-05,0
W3120253959,ResBCDU-Net: A Deep Learning Framework for Lung CT Image Segmentation,2021,3.713349300482234e-05,0
W2998216033,iFAN: Image-Instance Full Alignment Networks for Adaptive Object Detection,2020,3.7130557522964487e-05,0
W3177388720,RefineMask: Towards High-Quality Instance Segmentation with Fine-Grained Features,2021,3.712168815444182e-05,0
W4312844845,"Fashionformer: A Simple, Effective and Unified Baseline for Human Fashion Segmentation and Recognition",2022,3.712004108970088e-05,0
W4297878068,SLViT: Shuffle-convolution-based lightweight Vision transformer for effective diagnosis of sugarcane leaf diseases,2022,3.711337365433715e-05,0
W3049157029,Drone Image Segmentation Using Machine and Deep Learning for Mapping Raised Bog Vegetation Communities,2020,3.711307321649797e-05,0
W2969649120,Real-Time Object Detection With Reduced Region Proposal Network via Multi-Feature Concatenation,2019,3.709751198250896e-05,0
W3199427219,TransBridge: A Lightweight Transformer for Left Ventricle Segmentation in Echocardiography,2021,3.7096668984764325e-05,0
W3108139472,Tensor Low-Rank Reconstruction for Semantic Segmentation,2020,3.7093358291426224e-05,0
W4377024253,Multi-modal policy fusion for end-to-end autonomous driving,2023,3.70871591609049e-05,0
W4391401593,Lightweight transformer image feature extraction network,2024,3.7065432091151973e-05,0
W4387869523,Lightweight Image Inpainting By Stripe Window Transformer With Joint Attention To CNN,2023,3.706337448662939e-05,0
W4387956063,Multi-scale feature selection network for lightweight image super-resolution,2023,3.706015873798342e-05,0
W4226044101,Evolving Block-Based Convolutional Neural Network for Hyperspectral Image Classification,2022,3.705802554286475e-05,0
W4390654520,TFMFT: Transformer-based multiple fish tracking,2024,3.7057613193966165e-05,0
W4313451824,Fish school feeding behavior quantification using acoustic signal and improved Swin Transformer,2022,3.7057613193966165e-05,0
W4382449692,FeedFormer: Revisiting Transformer Decoder for Efficient Semantic Segmentation,2023,3.705730561224446e-05,0
W4323364877,EG-TransUNet: a transformer-based U-Net with enhanced and guided models for biomedical image segmentation,2023,3.705380601310119e-05,0
W4306734032,A 3D Cross-Modality Feature Interaction Network With Volumetric Feature Alignment for Brain Tumor and Tissue Segmentation,2022,3.704373764854895e-05,0
