id,title,year,pagerank,cluster
W3210097264,Night-Time Scene Parsing With a Large Real Dataset,2021,5.233636679444662e-05,0
W3046002702,Vibration-based damage detection for bridges by deep convolutional denoising autoencoder,2020,5.230689781563221e-05,0
W3171249923,Differentiable Multi-Granularity Human Representation Learning for Instance-Aware Human Semantic Parsing,2021,5.229697912684425e-05,0
W3109120382,Zero-Shot Video Object Segmentation with Co-Attention Siamese Networks,2020,5.229119298755605e-05,0
W4387338457,A survey of the vision transformers and their CNN-transformer based variants,2023,5.228207476137618e-05,0
W4287121509,Learning to Affiliate: Mutual Centralized Learning for Few-shot Classification,2022,5.227316427151896e-05,0
W3123394884,Activity Graph Transformer for Temporal Action Localization,2021,5.226512358245188e-05,0
W4389491034,CoCoNet: Coupled Contrastive Learning Network with Multi-level Feature Ensemble for Multi-modality Image Fusion,2023,5.223790925267717e-05,0
W3099004229,Smoothed Dilated Convolutions for Improved Dense Prediction,2018,5.2234970992781705e-05,0
W2890173472,Detail Preserving Depth Estimation from a Single Image Using Attention Guided Networks,2018,5.2219733932079684e-05,0
W3033996275,Ship Detection in Large-Scale SAR Images Via Spatial Shuffle-Group Enhance Attention,2020,5.221148458356863e-05,0
W4214934944,Ad-Corre: Adaptive Correlation-Based Loss for Facial Expression Recognition in the Wild,2022,5.218187807147204e-05,0
W3034600407,SmallBigNet: Integrating Core and Contextual Views for Video Classification,2020,5.217966825791804e-05,0
W3193414609,Bi-Temporal Semantic Reasoning for the Semantic Change Detection in HR Remote Sensing Images,2022,5.213405399280792e-05,0
W3205097059,Rotating Machinery Fault Diagnosis Through a Transformer Convolution Network Subjected to Transfer Learning,2021,5.212959162554543e-05,0
W3204245437,SMU-Net: Saliency-Guided Morphology-Aware U-Net for Breast Lesion Segmentation in Ultrasound Image,2021,5.2091211453171474e-05,0
W3202542211,Multi-compound Transformer for Accurate Biomedical Image Segmentation,2021,5.2045778330433355e-05,0
W3194949249,Facial expression recognition with grid-wise attention and visual transformer,2021,5.2034779580111996e-05,0
W3120244865,Analysis and best parameters selection for person recognition based on gait model using CNN algorithm and image augmentation,2021,5.203033032888767e-05,0
W3134912427,CDNet: Complementary Depth Network for RGB-D Salient Object Detection,2021,5.201452439804958e-05,0
W4292858649,Gastrointestinal abnormality detection and classification using empirical wavelet transform and deep convolutional neural network from endoscopic images,2022,5.1979671730393285e-05,0
W3162474807,Improved Residual Networks for Image and Video Recognition,2021,5.197319800776029e-05,0
W4393078930,TOPIQ: A Top-Down Approach From Semantics to Distortions for Image Quality Assessment,2024,5.19613919678259e-05,0
W3126768386,COVID-19 Chest CT Image Segmentation Network by Multi-Scale Fusion and Enhancement Operations,2021,5.1942477509860346e-05,0
W4220780913,DMA-Net: DeepLab With Multi-Scale Attention for Pavement Crack Segmentation,2022,5.193682374173426e-05,0
W2943270518,Automatic Design of Convolutional Neural Network for Hyperspectral Image Classification,2019,5.1916006062124715e-05,0
W4206211125,A Dynamic Residual Self-Attention Network for Lightweight Single Image Super-Resolution,2021,5.18822930848808e-05,0
W2976711440,Capsule Networks – A survey,2019,5.187016052075667e-05,0
W4321350869,GFANet: Gated Fusion Attention Network for skin lesion segmentation,2023,5.186855650869409e-05,0
W2963450895,Salient Object Detection via Multiple Instance Joint Re-Learning,2019,5.186315843464796e-05,0
W4226424839,Pale Transformer: A General Vision Transformer Backbone with Pale-Shaped Attention,2022,5.186133112736047e-05,0
W4361009418,Efficient Gastrointestinal Disease Classification Using Pretrained Deep Convolutional Neural Network,2023,5.185985125059876e-05,0
W3137744231,Building outline delineation: From aerial images to polygons with an improved end-to-end learning framework,2021,5.1841010127760264e-05,0
W2897828525,VSO: Visual Semantic Odometry,2018,5.1840929899867386e-05,0
W3209745495,Semantic segmentation of high-resolution remote sensing images based on a class feature attention mechanism fused with Deeplabv3+,2021,5.182927638072315e-05,0
W3090757175,From Handcrafted to Deep Features for Pedestrian Detection: A Survey,2021,5.1806236493920054e-05,0
W2929607865,Cross-modality interactive attention network for multispectral pedestrian detection,2018,5.1766339021291216e-05,0
W3217445779,Lightweight Underwater Object Detection Based on YOLO v4 and Multi-Scale Attentional Feature Fusion,2021,5.175883772890858e-05,0
W4226285265,Remote Sensing Image Scene Classification Using Multiscale Feature Fusion Covariance Network With Octave Convolution,2022,5.174615641392095e-05,0
W2997739323,Domain Conditioned Adaptation Network,2020,5.170987405906608e-05,0
W3129840128,SOSD-Net: Joint semantic object segmentation and depth estimation from monocular images,2021,5.170811741793834e-05,0
W4205166102,Impact of Deep Learning Approaches on Facial Expression Recognition in Healthcare Industries,2022,5.170040776303946e-05,0
W3045281502,Automated Detection and Forecasting of COVID-19 using Deep Learning Techniques: A Review,2020,5.1696197789253875e-05,0
W4379209584,Rethinking the necessity of image fusion in high-level vision tasks: A practical infrared and visible image fusion network based on progressive semantic injection and scene fidelity,2023,5.168895204894098e-05,0
W3174862668,MADAN: Multi-source Adversarial Domain Aggregation Network for Domain Adaptation,2021,5.167133936206457e-05,0
W3037080525,Multi-task convolutional neural networks outperformed random forest for mapping soil particle size fractions in central Iran,2020,5.1655845934273984e-05,0
W3091119025,VSSC Net: Vessel Specific Skip chain Convolutional Network for blood vessel segmentation,2020,5.165151781578855e-05,0
W4226028923,When Shift Operation Meets Vision Transformer: An Extremely Simple Alternative to Attention Mechanism,2022,5.1617935724095176e-05,0
W3202476840,Accounting for Dependencies in Deep Learning Based Multiple Instance Learning for Whole Slide Imaging,2021,5.161472696336175e-05,0
W3117707016,SCNet: Training Inference Sample Consistency for Instance Segmentation,2021,5.1614622107672354e-05,0
W4283818851,Comprehensive Regularization in a Bi-directional Predictive Network for Video Anomaly Detection,2022,5.158083592815259e-05,0
W4226396876,Activation Modulation and Recalibration Scheme for Weakly Supervised Semantic Segmentation,2022,5.157536489017197e-05,0
W3216987090,TransMEF: A Transformer-Based Multi-Exposure Image Fusion Framework Using Self-Supervised Multi-Task Learning,2022,5.1566611752353975e-05,0
W3162784696,Beyond Monocular Deraining: Parallel Stereo Deraining Network Via Semantic Prior,2022,5.151720696624899e-05,0
W3083948783,CNN-based encoder-decoder networks for salient object detection: A comprehensive review and recent advances,2020,5.1515098957692135e-05,0
W4283459038,Tiny‐Crack‐Net: A multiscale feature fusion network with attention mechanisms for segmentation of tiny cracks,2022,5.1496424262848075e-05,0
W3201659970,Trans-SVNet: Accurate Phase Recognition from Surgical Videos via Hybrid Embedding Aggregation Transformer,2021,5.148120186128939e-05,0
W3092878394,HOT-Net: Non-Autoregressive Transformer for 3D Hand-Object Pose Estimation,2020,5.147629625493014e-05,0
W4312671791,TinyViT: Fast Pretraining Distillation for Small Vision Transformers,2022,5.14563249768782e-05,0
W4386071839,OneFormer: One Transformer to Rule Universal Image Segmentation,2023,5.145371348158918e-05,0
W3185864054,On Feature Normalization and Data Augmentation,2021,5.144736394957017e-05,0
W3090853421,Traditional Method Inspired Deep Neural Network For Edge Detection,2020,5.144651239121977e-05,0
W4223589960,Swin transformer for fast MRI,2022,5.144467145839868e-05,0
W4223647842,Large‐scale structural health monitoring using composite recurrent neural networks and grid environments,2022,5.143491903505198e-05,0
W4221147148,Efficient Non-local Contrastive Attention for Image Super-resolution,2022,5.141832955249764e-05,0
W2955365692,Convolutional Neural Networks for the Automatic Identification of Plant Diseases,2019,5.1416143809761785e-05,0
W2982628450,Spatial information inference net: Road extraction using road-specific contextual information,2019,5.141018198961486e-05,0
W3173759468,Rich Embedding Features for One-Shot Semantic Segmentation,2021,5.1400426073714155e-05,0
W3186033197,Dynamic Region-Aware Convolution,2021,5.138829998013855e-05,0
W2966967545,D-UNet: A Dimension-Fusion U Shape Network for Chronic Stroke Lesion Segmentation,2019,5.138484805150666e-05,0
W3104610662,Attention Deeplabv3+: Multi-level Context Attention Mechanism for Skin Lesion Segmentation,2020,5.138421751553181e-05,0
W4226325015,xViTCOS: Explainable Vision Transformer Based COVID-19 Screening Using Radiography,2021,5.13706281232535e-05,0
W4206670089,Dense Attention-Guided Cascaded Network for Salient Object Detection of Strip Steel Surface Defects,2021,5.1358750430929045e-05,0
W2963521187,Towards Effective Low-Bitwidth Convolutional Neural Networks,2018,5.135116822487441e-05,0
W2949730766,CornerNet: Detecting Objects as Paired Keypoints,2018,5.1327703357972185e-05,0
W3035026422,Variational Context-Deformable ConvNets for Indoor Scene Parsing,2020,5.131487772844832e-05,0
W3044776120,Adaptive Effective Receptive Field Convolution for Semantic Segmentation of VHR Remote Sensing Images,2020,5.13103934230528e-05,0
W3159178846,MIDeepSeg: Minimally interactive segmentation of unseen objects from medical images using deep learning,2021,5.124048929889284e-05,0
W2885052112,Attention-based Pyramid Aggregation Network for Visual Place Recognition,2018,5.123388895093741e-05,0
W3214466318,EAPT: Efficient Attention Pyramid Transformer for Image Processing,2021,5.1214845935895214e-05,0
W3132963652,A convolutional neural network-based method for workpiece surface defect detection,2021,5.119676893551287e-05,0
W3198460218,NEAT: Neural Attention Fields for End-to-End Autonomous Driving,2021,5.117997718611618e-05,0
W3114429882,Deep Learning for Land Cover Change Detection,2020,5.113633329418032e-05,0
W2966927056,Noise-Aware Unsupervised Deep Lidar-Stereo Fusion,2019,5.113512580404266e-05,0
W4319986927,You can get smaller: A lightweight self-activation convolution unit modified by transformer for fault diagnosis,2023,5.107507034807655e-05,0
W3135262214,Duplex Contextual Relation Network For Polyp Segmentation,2022,5.106616890736348e-05,0
W3194686611,CFPNET: Channel-Wise Feature Pyramid For Real-Time Semantic Segmentation,2021,5.1056667163238196e-05,0
W3201107011,Real-time polyp detection model using convolutional neural networks,2021,5.104435308909027e-05,0
W4324144441,MedViT: A robust vision transformer for generalized medical image classification,2023,5.1028407161845025e-05,0
W3106949330,Feature-Aware Adaptation and Density Alignment for Crowd Counting in Video Surveillance,2020,5.101584598710632e-05,0
W4287367114,Deep Learning for Instance Retrieval: A Survey,2022,5.101452265141876e-05,0
W3185556852,Efficient Medical Image Segmentation Based on Knowledge Distillation,2021,5.101222853237914e-05,0
W4206390057,Res2Fusion: Infrared and Visible Image Fusion Based on Dense Res2net and Double Nonlocal Attention Models,2022,5.1004225082670386e-05,0
W4312713480,MonoDTR: Monocular 3D Object Detection with Depth-Aware Transformer,2022,5.098370927022782e-05,0
W3022565501,Contextual encoder–decoder network for visual saliency prediction,2020,5.095841769735699e-05,0
W4285170264,MITformer: A Multiinstance Vision Transformer for Remote Sensing Scene Classification,2022,5.09527859876625e-05,0
W3087980862,Parallax Attention for Unsupervised Stereo Correspondence Learning,2020,5.093495287169795e-05,0
W3215565096,FASSD-Net: Fast and Accurate Real-Time Semantic Segmentation for Embedded Systems,2021,5.089063558078896e-05,0
W3082097505,AGLNet: Towards real-time semantic segmentation of self-driving images via attention-guided lightweight network,2020,5.088447848801632e-05,0
W4312233661,Transformer-empowered Multi-scale Contextual Matching and Aggregation for Multi-contrast MRI Super-resolution,2022,5.088363002252468e-05,0
W3211135382,A transformer-based framework for automatic COVID19 diagnosis in chest CTs,2021,5.086171331738793e-05,0
W3001553836,Fusing multi-scale context-aware information representation for automatic in-field pest detection and recognition,2020,5.0848313881129406e-05,0
W4320018395,A Synergistical Attention Model for Semantic Segmentation of Remote Sensing Images,2023,5.08367969046841e-05,0
W4319159897,Lightweight image super-resolution based on deep learning: State-of-the-art and future directions,2023,5.082946004786936e-05,0
W3216860461,SC-EADNet: A Self-Supervised Contrastive Efficient Asymmetric Dilated Network for Hyperspectral Image Classification,2021,5.081943310227101e-05,0
W3154206785,Infrared small target segmentation with multiscale feature representation,2021,5.081402600318136e-05,0
W4312183515,Improved YOLOv5 network for real-time multi-scale traffic sign detection,2022,5.080359713105236e-05,0
W4313889909,Convolutional Neural Networks or Vision Transformers: Who Will Win the Race for Action Recognitions in Visual Data?,2023,5.079003727880138e-05,0
W3167695527,Vision Transformers with Patch Diversification,2021,5.0776034421966636e-05,0
W4281757580,Semi-supervised fault diagnosis of machinery using LPS-DGAT under speed fluctuation and extremely low labeled rates,2022,5.077154733697172e-05,0
W4290964450,Learning deep feature correspondence for unsupervised anomaly detection and segmentation,2022,5.077154733697172e-05,0
W2951787414,"Overview of image-to-image translation by use of deep neural networks: denoising, super-resolution, modality conversion, and reconstruction in medical imaging",2019,5.077154733697172e-05,0
W3174350209,Rethinking the Self-Attention in Vision Transformers,2021,5.076996384265597e-05,0
W4285601701,FQ-ViT: Post-Training Quantization for Fully Quantized Vision Transformer,2022,5.0768199226690035e-05,0
W2996884277,Progressive Feature Polishing Network for Salient Object Detection,2020,5.0758681908491293e-05,0
W3034243376,Robust Reference-Based Super-Resolution With Similarity-Aware Deformable Convolution,2020,5.07329600421667e-05,0
W4366352791,Dual Vision Transformer,2023,5.0706001555413376e-05,0
W4318767292,Change Detection on Remote Sensing Images Using Dual-Branch Multilevel Intertemporal Network,2023,5.0689951695792934e-05,0
W4366352735,LRRNet: A Novel Representation Learning Guided Fusion Network for Infrared and Visible Images,2023,5.068356711010404e-05,0
W3176047859,To Choose or to Fuse? Scale Selection for Crowd Counting,2021,5.068261127630369e-05,0
W2982413914,Coordinate-Based Texture Inpainting for Pose-Guided Human Image Generation,2019,5.0629034822652865e-05,0
W2909384861,Fine-Grained Visual-Textual Representation Learning,2019,5.0619960432180655e-05,0
W4221061906,Adaptive Perspective Distillation for Semantic Segmentation,2022,5.061913290705687e-05,0
W3190941789,Crop mapping from image time series: Deep learning with multi-scale label hierarchies,2021,5.061912103615775e-05,0
W3200891683,3D Transformer-GAN for High-Quality PET Reconstruction,2021,5.061534989223956e-05,0
W3174738881,CSWin Transformer: A General Vision Transformer Backbone with Cross-Shaped Windows,2021,5.0577754949045783e-05,0
W2943351376,Context-Reinforced Semantic Segmentation,2019,5.057711359652315e-05,0
W3128636476,Late Temporal Modeling in 3D CNN Architectures with BERT for Action Recognition,2020,5.0576305250866045e-05,0
W2988209803,Semi-Supervised Image Dehazing,2019,5.054986641475906e-05,0
W2954896312,Improving public data for building segmentation from Convolutional Neural Networks (CNNs) for fused airborne lidar and image data using active contours,2019,5.051933508910556e-05,0
W4385803570,A New CNN-based Single-Ingredient Classification Model and Its Application in Food Image Segmentation,2023,5.051662017315796e-05,0
W3181013887,Enhanced U-Net: A Feature Enhancement Network for Polyp Segmentation,2021,5.0497562708523957e-05,0
W3201048683,Defect detection of injection molding products on small datasets using transfer learning,2021,5.0466770684630196e-05,0
W3138958001,CE-FPN: enhancing channel information for object detection,2022,5.045742854438578e-05,0
W3187589338,Sharp U-Net: Depthwise convolutional network for biomedical image segmentation,2021,5.045046354813635e-05,0
W3173382343,"Locate Globally, Segment Locally: A Progressive Architecture With Knowledge Review Network for Salient Object Detection",2021,5.0442934972428095e-05,0
W2975350394,XNOR-Net++: Improved Binary Neural Networks,2019,5.044267831597273e-05,0
W4225982893,Vision Transformer for Pansharpening,2022,5.040853806021273e-05,0
W3202329792,Exploring Inter-Channel Correlation for Diversity-preserved Knowledge Distillation,2021,5.040201087540681e-05,0
W3097009184,Gait Lateral Network: Learning Discriminative and Compact Representations for Gait Recognition,2020,5.036715498457805e-05,0
W3198555736,Machine learning based liver disease diagnosis: A systematic review,2021,5.036225918294944e-05,0
W4205682476,"Swin Transformer and Deep Convolutional Neural Networks for Coastal Wetland Classification Using Sentinel-1, Sentinel-2, and LiDAR Data",2022,5.0357355611729184e-05,0
W3083550439,MS-TCN++: Multi-Stage Temporal Convolutional Network for Action Segmentation,2020,5.035425098680251e-05,0
W4283009331,XMorpher: Full Transformer for Deformable Medical Image Registration via Cross Attention,2022,5.0351356183454644e-05,0
W4313134080,SUNet: Swin Transformer UNet for Image Denoising,2022,5.034656948908699e-05,0
W4312981390,Multi-Level Representation Learning with Semantic Alignment for Referring Video Object Segmentation,2022,5.032648765135725e-05,0
W4282976788,Multimodal Transformer for Accelerated MR Imaging,2022,5.030593185362813e-05,0
W4386959728,MobileRaT: A Lightweight Radio Transformer Method for Automatic Modulation Classification in Drone Communication Systems,2023,5.027401856341151e-05,0
W3108614371,Social Adaptive Module for Weakly-Supervised Group Activity Recognition,2020,5.027393168469775e-05,0
W2948515602,Cross-View Semantic Segmentation for Sensing Surroundings,2020,5.025077120526646e-05,0
W4319300717,Enriched CNN-Transformer Feature Aggregation Networks for Super-Resolution,2023,5.024432696583592e-05,0
W3122006940,Salient Object Detection via Integrity Learning,2022,5.024325003774538e-05,0
W3175714707,Parser-Free Virtual Try-on via Distilling Appearance Flows,2021,5.020367657930446e-05,0
W3010381534,Progressive Domain Adaptation for Object Detection,2020,5.0201717923804934e-05,0
W3205764742,NViT: Vision Transformer Compression and Parameter Redistribution.,2021,5.019342352759478e-05,0
W3131151690,A-DenseUNet: Adaptive Densely Connected UNet for Polyp Segmentation in Colonoscopy Images with Atrous Convolution,2021,5.018494138773333e-05,0
W3154575015,Image Manipulation Detection by Multi-View Multi-Scale Supervision,2021,5.017897659154149e-05,0
W3090681715,Attention-Guided Multi-Branch Convolutional Neural Network for Mitosis Detection From Histopathological Images,2020,5.017288957426292e-05,0
W3012528238,RAPNet: Residual Atrous Pyramid Network for Importance-Aware Street Scene Parsing,2020,5.014323297209256e-05,0
W4312677967,DearKD: Data-Efficient Early Knowledge Distillation for Vision Transformers,2022,5.014090111291239e-05,0
W4289822973,ColonFormer: An Efficient Transformer Based Method for Colon Polyp Segmentation,2022,5.0133768401191616e-05,0
W4285277843,Mapping Coastal Wetlands Using Transformer in Transformer Deep Network on China ZY1-02D Hyperspectral Satellite Images,2022,5.0115938291294254e-05,0
W2981811634,Multi-source Domain Adaptation for Semantic Segmentation,2019,5.009685878261457e-05,0
W2975768142,HGR‐Net: a fusion network for hand gesture segmentation and recognition,2019,5.00940942199238e-05,0
W3081006173,Streaming Convolutional Neural Networks for End-to-End Learning With Multi-Megapixel Images,2020,5.0068133652579275e-05,0
W2990278031,CAGNet: Content-Aware Guidance for Salient Object Detection,2020,5.004286663682397e-05,0
W4225829036,MixFormer: Mixing Features across Windows and Dimensions,2022,5.001356321023149e-05,0
W3159337199,Beyond Self-attention: External Attention using Two Linear Layers for Visual Tasks,2021,4.9979544865077404e-05,0
W3169367294,VSPW: A Large-scale Dataset for Video Scene Parsing in the Wild,2021,4.99709597413274e-05,0
W4312765682,PCL: Proxy-based Contrastive Learning for Domain Generalization,2022,4.996001173841097e-05,0
W3110030584,Fast Video Object Segmentation Using the Global Context Module,2020,4.995823502185313e-05,0
W3007175960,"Locate, Size and Count: Accurately Resolving People in Dense Crowds via Detection",2020,4.993155636664433e-05,0
W3033114334,Video Object Segmentation and Tracking,2020,4.989629206829778e-05,0
W3034528588,Hit-Detector: Hierarchical Trinity Architecture Search for Object Detection,2020,4.989548390844468e-05,0
W3184620780,Breast cancer histopathological image classification using attention <scp>high‐order</scp> deep network,2021,4.988705173953136e-05,0
W4327652243,No More Strided Convolutions or Pooling: A New CNN Building Block for Low-Resolution Images and Small Objects,2023,4.985745173177194e-05,0
W4312263794,k-means Mask Transformer,2022,4.982525574598441e-05,0
W4313641702,ST-Unet: Swin Transformer boosted U-Net with Cross-Layer Feature Enhancement for medical image segmentation,2023,4.9823965473210535e-05,0
W3201612248,CDTrans: Cross-domain Transformer for Unsupervised Domain Adaptation,2021,4.9817471465974335e-05,0
W4210300019,Key.Net: Keypoint Detection by Handcrafted and Learned CNN Filters Revisited,2022,4.980228174874857e-05,0
W4378515451,A Deep Feature Fusion of Improved Suspected Keratoconus Detection with Deep Learning,2023,4.9795521634703124e-05,0
W3121634539,Improve Object Detection with Feature-based Knowledge Distillation: Towards Accurate and Efficient Detectors,2021,4.979328720000182e-05,0
W2963318220,Pedestrian Detection With Autoregressive Network Phases,2019,4.9792339465585864e-05,0
W3183817352,PPT Fusion: Pyramid Patch Transformerfor a Case Study in Image Fusion,2021,4.978789326283008e-05,0
W3118255477,Unsupervised Domain Adaptation in Semantic Segmentation via Orthogonal and Clustered Embeddings,2021,4.9778033542769396e-05,0
W3113453806,CNN with depthwise separable convolutions and combined kernels for rating prediction,2020,4.977277723001948e-05,0
W4285303509,MSTNet: A Multilevel Spectral–Spatial Transformer Network for Hyperspectral Image Classification,2022,4.977262896238488e-05,0
W2963094099,Discrimination-aware channel pruning for deep neural networks,2018,4.97117363966195e-05,0
W3011692687,Density-Aware Multi-Task Learning for Crowd Counting,2020,4.9701758874746474e-05,0
W4288391342,EMTCAL: Efficient Multiscale Transformer and Cross-Level Attention Learning for Remote Sensing Scene Classification,2022,4.9676653487376805e-05,0
W3175452902,TransRPPG: Remote Photoplethysmography Transformer for 3D Mask Face Presentation Attack Detection,2021,4.967160416263845e-05,0
W4285205872,FRNet: Feature Reconstruction Network for RGB-D Indoor Scene Parsing,2022,4.9642450225706146e-05,0
W4297094428,Convolution Transformer Mixer for Hyperspectral Image Classification,2022,4.9641338779284554e-05,0
W3176774696,Unveiling the Potential of Structure Preserving for Weakly Supervised Object Localization,2021,4.9633130691461475e-05,0
W3043740003,Semantic scene segmentation in unstructured environment with modified DeepLabV3+,2020,4.962039393725441e-05,0
W3134976640,A review of multimodal image matching: Methods and applications,2021,4.960348968702698e-05,0
W2987185654,SkyScapes ­ Fine-Grained Semantic Understanding of Aerial Scenes,2019,4.959082878391764e-05,0
W3009216045,RainNet v1.0: a convolutional neural network for radar-based precipitation nowcasting,2020,4.957747828042723e-05,0
W3029368604,Stacked U-Shape Network With Channel-Wise Attention for Salient Object Detection,2020,4.9569266205466686e-05,0
W3041497966,Remix: Rebalanced Mixup,2020,4.9547115713483966e-05,0
W4312772337,Vision Transformer Slimming: Multi-Dimension Searching in Continuous Optimization Space,2022,4.9541478479878554e-05,0
W3107497254,EfficientFCN: Holistically-Guided Decoding for Semantic Segmentation,2020,4.953905668315715e-05,0
W3211081651,Co-attentive multi-task convolutional neural network for facial expression recognition,2021,4.9507512883302606e-05,0
W3032400974,Hierarchical dense recursive network for image super-resolution,2020,4.947991447772464e-05,0
W4361218351,A Precise Image-Based Tomato Leaf Disease Detection Approach Using PLPNet,2023,4.9461388233263185e-05,0
W3136305497,Medical image segmentation based on active fusion-transduction of multi-stream features,2021,4.945117824854273e-05,0
W3158308652,Plant diseases recognition on images using convolutional neural networks: A systematic review,2021,4.9444803940811176e-05,0
W4206433182,Transformer-Based Multistage Enhancement for Remote Sensing Image Super-Resolution,2021,4.9409133896961824e-05,0
W4224246723,SSA-Net: Spatial self-attention network for COVID-19 pneumonia infection segmentation with semi-supervised few-shot learning,2022,4.940158426957262e-05,0
W3102922379,ULSAM: Ultra-Lightweight Subspace Attention Module for Compact Convolutional Neural Networks,2020,4.9396297605533044e-05,0
