id,title,year,pagerank,cluster
W4396674567,Exploration of an Open Vocabulary Model on Semantic Segmentation for Street Scene Imagery,2024,3.286051148880446e-05,0
W4400771722,Advanced Multimodal Deep Learning Architecture for Image-Text Matching,2024,3.286051148880446e-05,0
W4353055444,DSEU-net: A novel deep supervision SEU-net for medical ultrasound image segmentation,2023,3.286051148880446e-05,0
W3167376913,Computationally Efficient Multiscale Neural Networks Applied to Fluid Flow in Complex 3D Porous Media,2021,3.286051148880446e-05,0
W4401936978,Small Object Detection by DETR via Information Augmentation and Adaptive Feature Fusion,2024,3.286051148880446e-05,0
W4392693971,Hybrid Attention-Aware Transformer Network Collaborative Multiscale Feature Alignment for Building Change Detection,2024,3.286051148880446e-05,0
W4407614753,MambaSOD: Dual Mamba-driven cross-modal fusion network for RGB-D salient object detection,2025,3.286051148880446e-05,0
W4403753127,Cross-material battery capacity estimation using hybrid-model fusion transfer learning,2024,3.286051148880446e-05,0
W4319300603,OutfitTransformer: Learning Outfit Representations for Fashion Recommendation,2023,3.286051148880446e-05,0
W4286610451,An efficient EEG signal classification technique for Brain–Computer Interface using hybrid Deep Learning,2022,3.286051148880446e-05,0
W3113769242,On the Performance of One-Stage and Two-Stage Object Detectors in Autonomous Vehicles Using Camera Data,2020,3.286051148880446e-05,0
W4407973719,Learning few-shot semantic segmentation with error-filtered segment anything model,2025,3.286051148880446e-05,0
W4399040877,A lightweight deep convolutional neural network model for skin cancer image classification,2024,3.286051148880446e-05,0
W4288053443,LLDNet: A Lightweight Lane Detection Approach for Autonomous Cars Using Deep Learning,2022,3.286051148880446e-05,0
W4406693293,LocaLock: Enhancing Multi-Object Tracking in Satellite Videos via Local Feature Matching,2025,3.286051148880446e-05,0
W4382240316,A Simple Baseline for Multi-Camera 3D Object Detection,2023,3.286051148880446e-05,0
W4406981127,ViT-CAPS: Vision Transformer with Contrastive Adaptive Prompt Segmentation,2025,3.286051148880446e-05,0
W4226154576,Attention-Guided Multitask Convolutional Neural Network for Power Line Parts Detection,2022,3.286051148880446e-05,0
W3197527602,A Microcontroller is All You Need: Enabling Transformer Execution on Low-Power IoT Endnodes,2021,3.286051148880446e-05,0
W4307568035,Deep semi-supervised multiple instance learning with self-correction for DME classification from OCT images,2022,3.286051148880446e-05,0
W4392017386,Vegetable disease detection using an improved YOLOv8 algorithm in the greenhouse plant environment,2024,3.286051148880446e-05,0
W4395471044,Fine-Grained Recognition With Learnable Semantic Data Augmentation,2024,3.286051148880446e-05,0
W4396865683,Detecting Parkinson’s disease from shoe-mounted accelerometer sensors using convolutional neural networks optimized with modified metaheuristics,2024,3.286051148880446e-05,0
W4391344164,YOLO-Rlepose: Improved YOLO Based on Swin Transformer and Rle-Oks Loss for Multi-Person Pose Estimation,2024,3.286051148880446e-05,0
W4321107833,SCTN: Event-based object tracking with energy-efficient deep convolutional spiking neural networks,2023,3.286051148880446e-05,0
W4392845075,A retinal vessel segmentation network with multiple-dimension attention and adaptive feature fusion,2024,3.286051148880446e-05,0
W4392693690,Mutual Retinex: Combining Transformer and CNN for Image Enhancement,2024,3.286051148880446e-05,0
W4319983346,Deep learning-based segmentation of epithelial ovarian cancer on T2-weighted magnetic resonance images,2023,3.286051148880446e-05,0
W4320492316,A Semi-Supervised Method for Real-Time Forest Fire Detection Algorithm Based on Adaptively Spatial Feature Fusion,2023,3.286051148880446e-05,0
W4408739936,Part-aware distillation and aggregation network for human parsing,2025,3.286051148880446e-05,0
W4391537951,Multi-stream network with key frame sampling for human action recognition,2024,3.286051148880446e-05,0
W3173262613,Multiple Granularities Generative Adversarial Network for Recognition of Wafer Map Defects,2021,3.286051148880446e-05,0
W4392380324,Object Detection in Remote Sensing Images Based on Adaptive Multi-Scale Feature Fusion Method,2024,3.286051148880446e-05,0
W4220929385,Explanation-Driven Deep Learning Model for Prediction of Brain Tumour Status Using MRI Image Data,2022,3.286051148880446e-05,0
W4382469135,Exploring Tuning Characteristics of Ventral Stream’s Neurons for Few-Shot Image Classification,2023,3.286051148880446e-05,0
W4410326803,MDAAF: masked domain adversarial adaptation framework for unsupervised domain adaptive semantic segmentation,2025,3.286051148880446e-05,0
W4386076165,Distilling Self-Supervised Vision Transformers for Weakly-Supervised Few-Shot Classification &amp; Segmentation,2023,3.286051148880446e-05,0
W4386076701,SkyEye: Self-Supervised Bird's-Eye-View Semantic Mapping Using Monocular Frontal View Images,2023,3.286051148880446e-05,0
W4390829757,MCNMF-Unet: a mixture Conv-MLP network with multi-scale features fusion Unet for medical image segmentation,2024,3.286051148880446e-05,0
W4407549005,YOLO-AMM: A Real-Time Classroom Behavior Detection Algorithm Based on Multi-Dimensional Feature Optimization,2025,3.286051148880446e-05,0
W4408552806,"LiDAR, IMU, and camera fusion for simultaneous localization and mapping: a systematic review",2025,3.286051148880446e-05,0
W4391536531,Pest recognition in microstates state: an improvement of YOLOv7 based on Spatial and Channel Reconstruction Convolution for feature redundancy and vision transformer with Bi-Level Routing Attention,2024,3.286051148880446e-05,0
W3210054798,Intra-Inter View Interaction Network for Light Field Image Super-Resolution,2021,3.286051148880446e-05,0
W4406821873,An improved YOLOv8 model and mask convolutional autoencoder for multi-scale defect detection of ceramic tiles,2025,3.286051148880446e-05,0
W4406731470,Semi-Supervised Medical Image Segmentation Based on Frequency Domain Aware Stable Consistency Regularization,2025,3.286051148880446e-05,0
W4362531944,Automatic segmentation of prostate cancer metastases in PSMA PET/CT images using deep neural networks with weighted batch-wise dice loss,2023,3.286051148880446e-05,0
W4394625873,FG-Net: Facial Action Unit Detection with Generalizable Pyramidal Features,2024,3.286051148880446e-05,0
W4391582522,YOLO-Fall: A Novel Convolutional Neural Network Model for Fall Detection in Open Spaces,2024,3.286051148880446e-05,0
W4402754171,SeeSR: Towards Semantics-Aware Real-World Image Super-Resolution,2024,3.286051148880446e-05,0
W2933283617,CubiCasa5K: A Dataset and an Improved Multi-task Model for Floorplan Image Analysis,2019,3.286051148880446e-05,0
W4327953249,TSBA-YOLO: An Improved Tea Diseases Detection Model Based on Attention Mechanisms and Feature Fusion,2023,3.286051148880446e-05,0
W4390421984,Is Attention all You Need in Medical Image Analysis? A Review,2023,3.286051148880446e-05,0
W4407296370,LieCConv: An Image Classification Algorithm Based on Lie Group Convolutional Neural Network,2025,3.286051148880446e-05,0
W4391617014,GPONet: A two-stream gated progressive optimization network for salient object detection,2024,3.286051148880446e-05,0
W4409219268,Defect detection in EBSM components through selective box fusion of modern object detection,2025,3.286051148880446e-05,0
W4409765555,ShipFPN: New Feature Pyramid Network Architecture for Object Detection in High-Resolution Satellite Images: Application to Ship Detection,2025,3.286051148880446e-05,0
W4390670352,SAR-to-Optical Image Translation via an Interpretable Network,2024,3.286051148880446e-05,0
W4401630326,GTC: GNN-Transformer co-contrastive learning for self-supervised heterogeneous graph representation,2024,3.286051148880446e-05,0
W4407843702,Heavy Equipment Detection on Construction Sites Using You Only Look Once (YOLO-Version 10) with Transformer Architectures,2025,3.286051148880446e-05,0
W4408959878,IAMTrack: interframe appearance and modality tokens propagation with temporal modeling for RGBT tracking,2025,3.286051148880446e-05,0
W4212932569,Revisiting Local Descriptor for Improved Few-Shot Classification,2022,3.286051148880446e-05,0
W3154514470,CovidXrayNet: Optimizing data augmentation and CNN hyperparameters for improved COVID-19 detection from CXR,2021,3.286051148880446e-05,0
W4225744337,E2Style: Improve the Efficiency and Effectiveness of StyleGAN Inversion,2022,3.286051148880446e-05,0
W4399353220,A Systematic Review for Classification and Selection of Deep Learning Methods,2024,3.286051148880446e-05,0
W4406787564,Object detection in real-time video surveillance using attention based transformer-YOLOv8 model,2025,3.286051148880446e-05,0
W4404489005,BiFPN-YOLO: One-Stage Object Detection Integrating Bi-Directional Feature Pyramid Networks,2024,3.286051148880446e-05,0
W4391943446,EFLNet: Enhancing Feature Learning Network for Infrared Small Target Detection,2024,3.286051148880446e-05,0
W3125697162,RETRACTED: Deep learning for real-time semantic segmentation: Application in ultrasound imaging,2021,3.286051148880446e-05,0
W4406236671,Spiking-PhysFormer: Camera-based remote photoplethysmography with parallel spike-driven transformer,2025,3.286051148880446e-05,0
W4390754052,"<mml:math xmlns:mml=""http://www.w3.org/1998/Math/MathML"" altimg=""si65.svg"" display=""inline"" id=""d1e738""><mml:mi>k</mml:mi></mml:math>-NN attention-based video vision transformer for action recognition",2024,3.286051148880446e-05,0
W4410378885,Abstracting general syntax for XAI after decomposing explanation sub-components,2025,3.286051148880446e-05,0
W4406929386,Improving vehicle detection accuracy in complex traffic scenes through context attention and multi-scale feature fusion module,2025,3.286051148880446e-05,0
W4384525598,Research on Improved YOLOv5 for Low-Light Environment Object Detection,2023,3.286051148880446e-05,0
W3208413984,"DenResCov-19: A deep transfer learning network for robust automatic classification of COVID-19, pneumonia, and tuberculosis from X-rays",2021,3.286051148880446e-05,0
W4407247036,Tourist attraction image recognition and intelligent recommendation based on deep learning,2025,3.286051148880446e-05,0
W4403826941,Integrating SAM with Feature Interaction for Remote Sensing Change Detection,2024,3.286051148880446e-05,0
W3089683834,Detecting Prohibited Items in X-Ray Images: a Contour Proposal Learning Approach,2020,3.286051148880446e-05,0
W3209546070,Unmanned Surface Vessel Visual Object Detection Under All-Weather Conditions with Optimized Feature Fusion Network in YOLOv4,2021,3.286051148880446e-05,0
W4285221302,Crowd Counting by Using Top-k Relations: A Mixed Ground-Truth CNN Framework,2022,3.286051148880446e-05,0
W2999479658,Deep TEC: Deep Transfer Learning with Ensemble Classifier for Road Extraction from UAV Imagery,2020,3.286051148880446e-05,0
W4281696540,Evaluation of Vision Transformers for Traffic Sign Classification,2022,3.286051148880446e-05,0
W4372049010,Self-Attention Vision Transformer with Transfer Learning for Efficient Crops and Weeds Classification,2023,3.286051148880446e-05,0
W4317555108,FloLPIPS: A Bespoke Video Quality Metric for Frame Interpolation,2022,3.286051148880446e-05,0
W2963013250,Learning to Cluster for Proposal-Free Instance Segmentation,2018,3.286051148880446e-05,0
W4402753796,Multimodal Industrial Anomaly Detection by Crossmodal Feature Mapping,2024,3.286051148880446e-05,0
W4289985668,An Intelligent Weighted Object Detector for Feature Extraction to Enrich Global Image Information,2022,3.286051148880446e-05,0
W4403333737,Recent advances in Transformer technology for agriculture: A comprehensive survey,2024,3.286051148880446e-05,0
W3166456209,Automatic polyp detection and segmentation using shuffle efficient channel attention network,2021,3.286051148880446e-05,0
W4318070750,Non-contact diagnosis for gearbox based on the fusion of multi-sensor heterogeneous data,2023,3.286051148880446e-05,0
W4394987622,Enhancing ASD classification through hybrid attention-based learning of facial features,2024,3.286051148880446e-05,0
W4406946805,Feature Enhancement and Feedback Network for Change Detection in Remote Sensing Images,2025,3.286051148880446e-05,0
W4402727816,DSL-FIQA: Assessing Facial Image Quality via Dual-Set Degradation Learning and Landmark-Guided Transformer,2024,3.286051148880446e-05,0
W4366393633,Deep learning-assisted automated sewage pipe defect detection for urban water environment management,2023,3.286051148880446e-05,0
W4390506759,The improved YOLOv8 algorithm based on EMSPConv and SPE-head modules,2024,3.286051148880446e-05,0
W4406691739,Advancements in medical image segmentation: A review of transformer models,2025,3.286051148880446e-05,0
W4385258036,The role of artificial intelligence and digital technologies in dam engineering: Narrative review and outlook,2023,3.286051148880446e-05,0
W4389428575,Automated Construction Site Monitoring Based on Improved YOLOv8-seg Instance Segmentation Algorithm,2023,3.286051148880446e-05,0
W4380853077,CsAGP: Detecting Alzheimer's disease from multimodal images via dual-transformer with cross-attention and graph pooling,2023,3.286051148880446e-05,0
W4407724320,Semantic segmentation feature fusion network based on transformer,2025,3.286051148880446e-05,0
W4367301744,Deep learning of electromechanical impedance for concrete structural damage identification using 1-D convolutional neural networks,2023,3.286051148880446e-05,0
W4362696042,Application of the hybrid neural network model for energy consumption prediction of office buildings,2023,3.286051148880446e-05,0
W4385805169,A Unified Transformer-based Tracker for Anti-UAV Tracking,2023,3.286051148880446e-05,0
W2991015021,CSPNet: A New Backbone that can Enhance Learning Capability of CNN,2019,3.286051148880446e-05,0
W4390871945,SwinLSTM: Improving Spatiotemporal Prediction Accuracy using Swin Transformer and LSTM,2023,3.286051148880446e-05,0
W4281717414,AX-Unet: A Deep Learning Framework for Image Segmentation to Assist Pancreatic Tumor Diagnosis,2022,3.286051148880446e-05,0
W4387993820,TATrack: Target-aware transformer for object tracking,2023,3.286051148880446e-05,0
W4322628180,Transformer architecture based on mutual attention for image-anomaly detection,2023,3.286051148880446e-05,0
W3213997984,Region- and Strength-Controllable GAN for Defect Generation and Segmentation in Industrial Images,2021,3.286051148880446e-05,0
W4390614533,An interpretable horizontal federated deep learning approach to improve short-term solar irradiance forecasting,2024,3.286051148880446e-05,0
W4401215101,Road damage detection and classification using deep neural networks,2024,3.286051148880446e-05,0
W4381059942,Sensitivity of measuring the urban form and greenery using street-level imagery: A comparative study of approaches and visual perspectives,2023,3.286051148880446e-05,0
W4377108105,ELCT-YOLO: An Efficient One-Stage Model for Automatic Lung Tumor Detection Based on CT Images,2023,3.286051148880446e-05,0
W4372260396,Fast Single-Person 2D Human Pose Estimation Using Multi-Task Convolutional Neural Networks,2023,3.286051148880446e-05,0
W4391164402,An Explainable and Lightweight Improved 1-D CNN Model for Vibration Signals of Rotating Machinery,2024,3.286051148880446e-05,0
W4321608108,Egocentric Early Action Prediction via Multimodal Transformer-Based Dual Action Prediction,2023,3.286051148880446e-05,0
W4406164026,TMVF: Trusted Multi-View Fish Behavior Recognition with correlative feature and adaptive evidence fusion,2025,3.286051148880446e-05,0
W4283720661,Online action proposal generation using spatio-temporal attention network,2022,3.286051148880446e-05,0
W4406085334,CTHNet: A CNN–Transformer Hybrid Network for Landslide Identification in Loess Plateau Regions Using High-Resolution Remote Sensing Images,2025,3.286051148880446e-05,0
W4313407000,Hybrid feature enhancement network for few-shot semantic segmentation,2023,3.286051148880446e-05,0
W4386702641,UCDFormer: Unsupervised Change Detection Using a Transformer-Driven Image Translation,2023,3.286051148880446e-05,0
W4391678605,A wind turbine damage detection algorithm designed based on YOLOv8,2024,3.286051148880446e-05,0
W3184606750,Image-Based Wheat Fungi Diseases Identification by Deep Learning,2021,3.286051148880446e-05,0
W4386075927,Deformable Mesh Transformer for 3D Human Mesh Recovery,2023,3.286051148880446e-05,0
W4317761513,Mutiscale Hybrid Attention Transformer for Remote Sensing Image Pansharpening,2023,3.286051148880446e-05,0
W4402727005,CorrMatch: Label Propagation via Correlation Matching for Semi-Supervised Semantic Segmentation,2024,3.286051148880446e-05,0
W4409680827,Feature distance-weighted adaptive decoupled knowledge distillation for medical image segmentation,2025,3.286051148880446e-05,0
W3205561316,Screening of COVID-19 Suspected Subjects Using Multi-Crossover Genetic Algorithm Based Dense Convolutional Neural Network,2021,3.286051148880446e-05,0
W4406039833,RamIR: Reasoning and action prompting with Mamba for all-in-one image restoration,2025,3.286051148880446e-05,0
W2904299207,CONV-SRAM: An Energy-Efficient SRAM With In-Memory Dot-Product Computation for Low-Power Convolutional Neural Networks,2018,3.286051148880446e-05,0
W4408446475,TMSF: Taylor Expansion Approximation Network with Multi-Stage Feature Representation for Optical Flow Estimation,2025,3.286051148880446e-05,0
W4408189749,Graph-based interactive knowledge distillation for social relation continual learning,2025,3.286051148880446e-05,0
W4379528676,LRAF-Net: Long-Range Attention Fusion Network for Visible–Infrared Object Detection,2023,3.286051148880446e-05,0
W4392751976,Computer vision for wildfire detection: a critical brief review,2024,3.286051148880446e-05,0
W4386076114,High-Frequency Stereo Matching Network,2023,3.286051148880446e-05,0
W4312948884,CNN-Transformer Based Generative Adversarial Network for Copy-Move Source/ Target Distinguishment,2022,3.286051148880446e-05,0
W4410263928,Optimizing human action classification: Data preprocessing and feature-based splitting strategies for enhanced model performance,2025,3.286051148880446e-05,0
W4322502569,Multi-Attention Segmentation Networks Combined with the Sobel Operator for Medical Images,2023,3.286051148880446e-05,0
W4392903274,Hyperspectral Image Classification Using Groupwise Separable Convolutional Vision Transformer Network,2024,3.286051148880446e-05,0
W4365517415,FontTransformer: Few-shot high-resolution Chinese glyph image synthesis via stacked transformers,2023,3.286051148880446e-05,0
W4312723609,Self-supervised Sparse Representation for Video Anomaly Detection,2022,3.286051148880446e-05,0
W4390963893,ADF-Net: A novel adaptive dual-stream encoding and focal attention decoding network for skin lesion segmentation,2024,3.286051148880446e-05,0
W4402702923,Salience DETR: Enhancing Detection Transformer with Hierarchical Salience Filtering Refinement,2024,3.286051148880446e-05,0
W4407392677,Optimizing Multiclass Classification Using Convolutional Neural Networks with Class Weights and Early Stopping for Imbalanced Datasets,2025,3.286051148880446e-05,0
W3208787894,Fusing CNNs and statistical indicators to improve image classification,2021,3.286051148880446e-05,0
W4312988191,Transformer-Based Device-Type Identification in Heterogeneous IoT Traffic,2022,3.286051148880446e-05,0
W4386071619,Multispectral Video Semantic Segmentation: A Benchmark Dataset and Baseline,2023,3.286051148880446e-05,0
W4395053280,Image recognition based on lightweight convolutional neural network: Recent advances,2024,3.286051148880446e-05,0
W4390547919,Toward interpretable anomaly detection for autonomous vehicles with denoising variational transformer,2024,3.286051148880446e-05,0
W4408021642,Learning prototypes from background and latent objects for few-shot semantic segmentation,2025,3.286051148880446e-05,0
W4380763459,Lightweight Asymmetric Convolutional Distillation Network for Single Image Super-Resolution,2023,3.286051148880446e-05,0
W4391048157,Non-invasive fractional flow reserve estimation using deep learning on intermediate left anterior descending coronary artery lesion angiography images,2024,3.286051148880446e-05,0
W4392114290,Dynamically updated semi-supervised change detection network combining cross-supervision and screening algorithms,2024,3.286051148880446e-05,0
W4392763775,Softmax-Free Linear Transformers,2024,3.286051148880446e-05,0
W4386766835,Transformer-Based Parking Slot Detection Using Fixed Anchor Points,2023,3.286051148880446e-05,0
W4387609230,Tiny Machine Learning: Progress and Futures [Feature],2023,3.286051148880446e-05,0
W4377235208,Transformer-Based Multi-Scale Feature Integration Network for Video Saliency Prediction,2023,3.286051148880446e-05,0
W4387221248,AUTOMATIC POLYP SEMANTIC SEGMENTATION USING WIRELESS CAPSULE ENDOSCOPY IMAGES WITH VARIOUS CONVOLUTIONAL NEURAL NETWORK AND OPTIMIZATION TECHNIQUES: A COMPARISON AND PERFORMANCE EVALUATION,2023,3.286051148880446e-05,0
W4401200174,ITFuse: An interactive transformer for infrared and visible image fusion,2024,3.286051148880446e-05,0
W4399327682,Attention-Based Multi-Kernelized and Boundary-Aware Network for image semantic segmentation,2024,3.286051148880446e-05,0
W4382918240,Leveraging dendritic properties to advance machine learning and neuro-inspired computing,2024,3.286051148880446e-05,0
W4387656276,Convolutional Neural Network,2023,3.286051148880446e-05,0
W4386576565,Convolutional Neural Networks for Beginners,2023,3.286051148880446e-05,0
W4409314121,Language-guided reasoning segmentation for underwater images,2025,3.286051148880446e-05,0
W4393148751,Label-Efficient Few-Shot Semantic Segmentation with Unsupervised Meta-Training,2024,3.286051148880446e-05,0
W4394002385,Masked Feature Modeling for Generative Self-Supervised Representation Learning of High-Resolution Remote Sensing Images,2024,3.286051148880446e-05,0
W4391124585,Using hybrid pre-trained models for breast cancer detection,2024,3.286051148880446e-05,0
W4402714520,Transformers in biosignal analysis: A review,2024,3.286051148880446e-05,0
W4297347930,A Novel Multi-Feature Fusion Method for Classification of Gastrointestinal Diseases Using Endoscopy Images,2022,3.286051148880446e-05,0
W4392209962,Advancing AI-Generated Image Detection: Enhanced Accuracy through CNN and Vision Transformer Models with Explainable AI Insights,2023,3.286051148880446e-05,0
W4321447187,Detection of Asphalt Pavement Cracks Based on Vision Transformer Improved YOLO V5,2023,3.286051148880446e-05,0
W4407386161,RQVR: A multi-exposure image fusion network that optimizes rendering quality and visual realism,2025,3.286051148880446e-05,0
W4387063747,Transformer-Based Under-Sampled Single-Pixel Imaging,2023,3.286051148880446e-05,0
W4399359054,Cycle contrastive adversarial learning with structural consistency for unsupervised high-quality image deraining transformer,2024,3.286051148880446e-05,0
W4387211595,SwinUNETR-V2: Stronger Swin Transformers with Stagewise Convolutions for 3D Medical Image Segmentation,2023,3.286051148880446e-05,0
W4377094377,Investigation and benchmarking of U-Nets on prostate segmentation tasks,2023,3.286051148880446e-05,0
W4308616028,Face-mask-aware Facial Expression Recognition based on Face Parsing and Vision Transformer,2022,3.286051148880446e-05,0
W4391110866,Multiclass AI-Generated Deepfake Face Detection Using Patch-Wise Deep Learning Model,2024,3.286051148880446e-05,0
W4390733995,Enhanced YOLO Network for Improving the Efficiency of Traffic Sign Detection,2024,3.286051148880446e-05,0
W4408958047,FusionLungNet: Multi-scale fusion convolution with refinement network for lung CT image segmentation,2025,3.286051148880446e-05,0
W4400582175,Multi-modal Prototypes for Open-World Semantic Segmentation,2024,3.286051148880446e-05,0
W4394751943,A cross-stage features fusion network for building extraction from remote sensing images,2024,3.286051148880446e-05,0
W4293235570,CCST: crowd counting with swin transformer,2022,3.286051148880446e-05,0
W4376880182,Multi-head attention-based probabilistic CNN-BiLSTM for day-ahead wind speed forecasting,2023,3.286051148880446e-05,0
W4392562987,MFIL-FCOS: A Multi-Scale Fusion and Interactive Learning Method for 2D Object Detection and Remote Sensing Image Detection,2024,3.286051148880446e-05,0
W4385647206,HoughLaneNet: Lane detection with deep hough transform and dynamic convolution,2023,3.286051148880446e-05,0
W4292506141,Vision Transformer for Detecting Critical Situations and Extracting Functional Scenario for Automated Vehicle Safety Assessment,2022,3.286051148880446e-05,0
W4393282120,Medical image segmentation network based on multi-scale frequency domain filter,2024,3.286051148880446e-05,0
W4386075771,Rethinking Optical Flow from Geometric Matching Consistent Perspective,2023,3.286051148880446e-05,0
W3134827261,Notice of Violation of IEEE Publication Principles: Grape Disease Detection Network Based on Multi-Task Learning and Attention Features,2021,3.286051148880446e-05,0
W3207293609,Automatic fault detection on seismic images using a multiscale attention convolutional neural network,2021,3.286051148880446e-05,0
W4391708463,GLFNet: Global-local fusion network for the segmentation in ultrasound images,2024,3.286051148880446e-05,0
W4388240426,Multi-Manifold Attention for Vision Transformers,2023,3.286051148880446e-05,0
W4408258790,Mfe-net: a multiscale feature enhanced network for mesoscale convective systems identification,2025,3.286051148880446e-05,0
W4391484958,Modified DeeplabV3+ with multi-level context attention mechanism for colonoscopy polyp segmentation,2024,3.286051148880446e-05,0
